303,BDARec: Balancing Diversity and Accuracy of Recommendation Model with Graph Neural Networks,2025,2025 International Joint Conference on Neural Networks (IJCNN),Not Disscused,"—Based on research in cognitive psychology, humans typically seek a balance between their preference for familiar things and the exploration of new ones during decision-making. Therefore, studying the relationship between accuracy and di- versity in recommendation systems is particularly meaningful. In recent years, recommender systems based on Graph Neural Networks (GNNs) have garnered significant attention for enhanc- ing recommendation accuracy or diversity. However, existing works often impr",Proposed model (name not captured),"GCN, GAT",Not Disscused,"Amazon, Beibei, Taobao",Not Disscused,,Real-world,Healthcare,Yes,SOFTMAX,Introduce non-linearity,Not Disscused,Adam/AdamW,"Recommendation, Prediction",Not Disscused,"Mean, Sum, Max, Attention","Mean, Sum, Max, Attention",Not Disscused,Weight decay/L2,Not Disscused,Not Disscused,Not Disscused,Not Disscused,Not Disscused,"Mean, Sum, Max, Attention",Not Disscused,Not Disscused,"GCN, GAT",Not Disscused,Yes,Yes,Yes,Not Disscused,Not Disscused,"Heterogeneous, Temporal/Dynamic, Knowledge graph","GCN, GAT",IEEE
304,Violating Content Detection Based on Knowledge Graph and Heterogeneous Graph Neural Network,2025,2025 International Joint Conference on Neural Networks (IJCNN),Not Disscused,"—With the rise of online social interactions in recent years, social media platforms have been increasingly targeted by various forms of violating posts. Effectively detecting and removing such content is critical for ensuring the healthy and compliant development of these platforms. To mitigate the chal- lenges posed by limited supervision, AI-based techniques have been widely adopted for violating content detection. However, their effectiveness remains signiﬁcantly constrained due to adver- sa",Proposed model (name not captured),"GCN, GAT, GraphSAGE, GIN, HAN",Not Disscused,"Amazon, Post-User, CREDBANK, ISOT, Kaggle, User",Public,https://blog.google/products/search/introducing-knowledge-graph-things,Real-world,Healthcare,Not Disscused,ReLU,Introduce non-linearity,Not Disscused,Adam/AdamW,"Node classification, Recommendation","BERT, CNN, LSTM","Mean, Sum, Attention","Mean, Sum, Attention","Semi-supervised, Inductive, Supervised","Dropout, Early stopping",Not Disscused,"DGL, TensorFlow/Keras",Not Disscused,Not Disscused,Not Disscused,"Mean, Sum, Attention",Yes,Regularization,"GCN, GAT, GraphSAGE, GIN",Not Disscused,Yes,Not Disscused,Yes,Not Disscused,"Semi-supervised, Inductive, Supervised","Heterogeneous, Temporal/Dynamic, Knowledge graph","GCN, GAT, GraphSAGE, GIN, CNN, LSTM, BERT, Transformer",https://github.com/yq62556369/
305,Graph Neural Networks-Based Digital Twin Modeling of WBC and ANC Dynamics for Personalized Time-Series Prediction,2025,2025 Medical Technologies Congress (TIPTEKNO),Not Disscused,"— This study introduces a digital twin model approach  with Graph Neural Networks (GNNs) to forecast white blood cell  (WBC) and absolute neutrophil count (ANC) levels during 6- mercaptopurine (6-MP) chemotherapy for treating childhood  acute lymphoblastic leukemia (ALL). For incorporating clinical  and lifestyle factors like daily medication dosage, anthropometric  measurements (weight, height, and body surface area), diet,  exercise, and vitamin D intake, the model is constructed using a  synt",Not Disscused,TGN,Not Disscused,Not Disscused,Not Disscused,,Not Disscused,Healthcare,Not Disscused,Not Disscused,Not Disscused,"MSE, MAE",Not Disscused,"Prediction, Classification",Not Disscused,"Mean, Sum","Mean, Sum",Not Disscused,Not Disscused,Not Disscused,PyTorch Geometric,Not Disscused,Not Disscused,Not Disscused,"Mean, Sum",Not Disscused,Not Disscused,TGN,Not Disscused,Not Disscused,Yes,Yes,Not Disscused,Not Disscused,Temporal/Dynamic,Not Disscused,IEEE
306,Federated Learning Framework for Adaptive Spatio-Temporal Graph Neural Networks in Weather Forecasting,2025,2025 National Conference on Communications (NCC),Not Disscused,"—Accurate weather forecasting is vital for sectors such as agriculture and disaster management, where timely and precise predictions can signiﬁcantly impact outcomes. Conventional forecasting methods of- ten struggle in accurately capturing the complex spatio- temporal dependencies inherent in meteorological data. The proliferation of modern sensor-equipped devices, such as smartphones, enables decentralized and real-time data collection, providing opportunities for large-scale predic- tive mode",Not Disscused,"GCN, Spatio-temporal, STGCN",Not Disscused,Not Disscused,Not Disscused,,Real-world,Healthcare,Not Disscused,SOFTMAX,Introduce non-linearity,"MSE, MAE",Not Disscused,"Link prediction/classification, Prediction","CNN, LSTM, GRU","Mean, Sum, Max, Attention","Mean, Sum, Max, Attention","Semi-supervised, Federated, Supervised",Dropout,Not Disscused,Not Disscused,Not Disscused,Not Disscused,Not Disscused,"Mean, Sum, Max, Attention",Yes,Regularization,"GCN, Spatio-temporal, STGCN",Not Disscused,Yes,Yes,Yes,Not Disscused,"Semi-supervised, Federated, Supervised",Temporal/Dynamic,"GCN, LSTM, GRU",IEEE
307,"Quantum-Resilient GNN and CLD-Net Framework for Intrusion Detection in 6G Networks: Comparative Analysis with CNN, RNN, and Hybrid Deep Learning Models",2025,2025 Tenth International Conference on Science Technology Engineering and Mathematics (ICONSTEM),Not Disscused,"-The evolution of 6G networks introduces  unprecedented bandwidth, ultra-low latency, and hyper- connectivity,  creating  both  opportunities  and  vulnerabilities in network security. Conventional intrusion  detection systems (IDS) based on a set of static signatures  or simplistic forms of learning no longer suffice to  respond to emerging threats like zero-day attacks and  adversarial manipulation. This paper suggests a Quantum- Resilient graph neural network (GNN) with a Contextual  Long-ter",Not Disscused,"GCN, HAN",Not Disscused,"CIC-DDoS, CIC-dDoS",Not Disscused,Not Disscused,Benchmark,Transportation/Traffic,Not Disscused,TANH,Introduce non-linearity,Not Disscused,Not Disscused,"Prediction, Classification","CNN, LSTM, GRU","Mean, Sum, Max, Attention","Mean, Sum, Max, Attention","Federated, Supervised, Unsupervised",Not Disscused,Not Disscused,Not Disscused,Not Disscused,Not Disscused,Not Disscused,"Mean, Sum, Max, Attention",Not Disscused,Not Disscused,"GCN, HAN",Not Disscused,Yes,Yes,Yes,Yes,"Federated, Supervised, Unsupervised","Heterogeneous, Temporal/Dynamic","GCN, SVM, CNN, LSTM, GRU, Random Forest",IEEE
308,Integrating Environmental Toxins into Biomedical Knowledge Graphs for Disease Prediction Using Graph Neural Networks,2025,2025 Twelfth International Conference on Intelligent Computing and Information Systems (ICICIS),Not Disscused,"— Environmental toxins interact with disease  determinants in complex ways, requiring computational  structures able to capture biological heterogeneity. Graph  Neural Networks (GNNs) represent a promising conceptual  framework to describe such complicated interplays. In our  current research, we build a heterogeneous biomedical  knowledge graph (KG) based on the Toxin and Toxin Target  Database (T3DB) 1, containing 49,501 nodes and 89,988 edges  which are toxins, symptoms, protein/gene targets,",Not Disscused,"GCN, GAT, R-GCN, Graph Transformer",Not Disscused,Tox21,Not Disscused,,Benchmark,Healthcare,Yes,Not Disscused,Not Disscused,Not Disscused,Adam/AdamW,"Link prediction/classification, Prediction",Not Disscused,"Mean, Sum, Max, Attention","Mean, Sum, Max, Attention","Semi-supervised, Supervised","Dropout, Weight decay/L2, Early stopping",Not Disscused,PyTorch Geometric,Not Disscused,Yes,Not Disscused,"Mean, Sum, Max, Attention",Yes (0.2),Regularization,"GCN, GAT, R-GCN, Graph Transformer",64,Yes,Not Disscused,Yes,Not Disscused,"Semi-supervised, Supervised","Heterogeneous, Temporal/Dynamic, Knowledge graph","GCN, GAT, MLP",IEEE
309,CPP-GNN: A Temporal Hypergraph Neural Network for Carbon Price Prediction in Electricity Market,2025,IECON 2025 – 51st Annual Conference of the IEEE Industrial Electronics Society,Not Disscused,"—As climate change intensifies, the electricity industry is crucial for achieving carbon neutrality, but carbon price volatility makes prediction challenging. Traditional statistical and econometric models struggle to capture the nonlinear features of carbon prices effectively. In recent years, deep learning methods, particularly Graph Neural Networks (GNNs), have made significant progress in modeling spatial and temporal dependencies. However, traditional GNNs face limitations in handling highe",Not Disscused,"GCN, HAN, MPNN/message passing, Hypergraph",Not Disscused,SHEA,Not Disscused,https://data.stats.gov.cn/.,Benchmark,Transportation/Traffic,Not Disscused,SOFTMAX,Introduce non-linearity,"MSE, MAE",Not Disscused,"Prediction, Classification","CNN, LSTM, GRU","Mean, Sum, Max, Attention","Mean, Sum, Max, Attention","Semi-supervised, Supervised",Not Disscused,Not Disscused,Not Disscused,Not Disscused,Not Disscused,Not Disscused,"Mean, Sum, Max, Attention",Not Disscused,Not Disscused,"GCN, HAN, MPNN/message passing, Hypergraph",Not Disscused,Yes,Yes,Yes,Not Disscused,"Semi-supervised, Supervised","Temporal/Dynamic, Knowledge graph, Hypergraph","GCN, MLP, CNN, LSTM, GRU, Transformer",IEEE
310,TGN-RiBC: A Betweenness-Aware Temporal Graph Neural Network for Power Grid Risk Prediction under Dynamic Unit Commitment,2025,IECON 2025 – 51st Annual Conference of the IEEE Industrial Electronics Society,Not Disscused,"—Accurate and efficient operational risk prediction is critical for modern power systems facing dynamic unit com- mitment and renewable integration. Existing machine learning and deep learning approaches often ignore grid topology or temporal evolution, limiting their ability to capture fault prop- agation under evolving system states. We propose TGN-RiBC, a Betweenness-Aware Temporal Graph Neural Network that incorporates temporal attention, temporal betweenness central- ity (TBC), and contrast",TGN,"GAT, GraphSAGE, HAN, MPNN/message passing, TGN",Not Disscused,Not Disscused,Not Disscused,Not Disscused,Real-world,Healthcare,Not Disscused,"LEAKYRELU, SIGMOID, SOFTMAX",Introduce non-linearity,Contrastive loss,Not Disscused,"Link prediction/classification, Prediction","CNN, LSTM, GRU","Mean, Max, Attention","Mean, Max, Attention","Contrastive, Inductive",Not Disscused,Not Disscused,Not Disscused,Not Disscused,Not Disscused,Not Disscused,"Mean, Max, Attention",Not Disscused,Not Disscused,"GAT, GraphSAGE, HAN, MPNN/message passing",Not Disscused,Yes,Yes,Yes,Not Disscused,"Contrastive, Inductive",Temporal/Dynamic,"GAT, GraphSAGE, MLP, LSTM, GRU, Random Forest",IEEE
311,A Spatio-Temporal Tensor Graph Neural Network-Based Method for Node-Link Prediction in Port Networks,2025,IEEE Access,Not Disscused,"Port network information security has received extensive attention in recent years, in which the prediction of node links in the network is significant. A Port network is a dynamic network, and its structure changes continuously with time. Therefore, to effectively utilize the information of the dynamic network and improve the prediction efficiency as well as the prediction accuracy, this paper proposes a spatio-temporal tensor graph neural network model, which learns graph structural features f",Not Disscused,"GCN, GAT, GraphSAGE, HAN, TGN",Not Disscused,"BCO, Hepth, BCA",Not Disscused,,Real-world,Healthcare,Not Disscused,Not Disscused,Not Disscused,Cross-Entropy,Not Disscused,"Link prediction/classification, Prediction","CNN, LSTM, GRU","Mean, Sum, Max, Attention","Mean, Sum, Max, Attention","Federated, Supervised, Unsupervised",Not Disscused,Not Disscused,Not Disscused,Not Disscused,Not Disscused,Not Disscused,"Mean, Sum, Max, Attention",Not Disscused,Not Disscused,"GCN, GAT, GraphSAGE, HAN",Not Disscused,Yes,Yes,Yes,Not Disscused,"Federated, Supervised, Unsupervised","Heterogeneous, Temporal/Dynamic","GCN, GAT, GraphSAGE, MLP, SVM, LSTM, GRU, Transformer",IEEE
312,FedHiGraphSAGE: A Hierarchical Graph Neural Network Model for Multi-Level Anomaly Detection in Federated Cloud Environments,2025,IEEE Access,Not Disscused,"Anomaly detection in cloud computing environments is increasingly challenging due to the complexity of distributed architectures, the heterogeneity of infrastructure components, and the high volume of monitoring data. Traditional anomaly detection approaches typically provide limited classification capabilities, often failing to identify the specific type and exact location of anomalies within complex cloud infrastructures. This paper introduces a novel multi-level anomaly detection and classifi",Not Disscused,"GCN, GAT, GraphSAGE, HAN, MPNN/message passing",Not Disscused,Not Disscused,Not Disscused,,Real-world,Healthcare,Not Disscused,GELU,Introduce non-linearity,Focal loss,Adam/AdamW,"Node classification, Prediction","LSTM, GRU","Mean, Sum, Max, Attention","Mean, Sum, Max, Attention","Semi-supervised, Self-supervised, Federated","Dropout, Weight decay/L2, Early stopping, Normalization",Not Disscused,PyTorch,BatchNorm,Not Disscused,Not Disscused,"Mean, Sum, Max, Attention",Yes (0.3),Regularization,"GCN, GAT, GraphSAGE, HAN",Not Disscused,Yes,Not Disscused,Yes,Yes,"Semi-supervised, Self-supervised, Federated","Heterogeneous, Temporal/Dynamic, Knowledge graph, Homogeneous","GCN, GAT, GraphSAGE, MLP, LSTM, GRU, Transformer",IEEE
313,GNN-EADD: Graph Neural Network-Based E-Commerce Anomaly Detection via Dual-Stage Learning,2025,IEEE Access,Not Disscused,"E-commerce platforms face significant challenges in detecting anomalous products, including counterfeit goods and fraudulent listings, which can undermine user trust and platform integrity. This paper presents Graph Neural Network-based E-commerce Anomaly Detection via Dual-stage Learning (GNN-EADD), a novel approach leveraging graph neural networks for anomaly detection in large- scale e-commerce ecosystems. Our key contributions include: 1) A heterogeneous graph representation incorporating pr",Not Disscused,"GCN, GAT, GraphSAGE, HAN, MPNN/message passing",Not Disscused,"Amazon, Reviews, This",Not Disscused,,Real-world,Healthcare,Not Disscused,"ReLU, LEAKYRELU, SIGMOID",Introduce non-linearity,"Cross-Entropy, Binary Cross-Entropy",Adam/AdamW,"Graph classification, Prediction",CNN,"Mean, Sum, Max, Attention","Mean, Sum, Max, Attention","Semi-supervised, Inductive, Supervised",Not Disscused,Not Disscused,Not Disscused,Not Disscused,Not Disscused,Not Disscused,"Mean, Sum, Max, Attention",Not Disscused,Not Disscused,"GCN, GAT, GraphSAGE, HAN",Not Disscused,Yes,Not Disscused,Yes,Not Disscused,"Semi-supervised, Inductive, Supervised","Heterogeneous, Temporal/Dynamic, Homogeneous","GCN, GAT, GraphSAGE",IEEE
314,Spatial-Spectral Contrastive Graph Neural Network for Few-Shot Hyperspectral Image Classification,2025,IEEE Access,Not Disscused,"Graph Neural Networks (GNNs) have emerged as a promising solution for few-shot hyperspectral image (HSI) classification. However, existing GNN-based approaches face critical limitations in three key aspects: 1) suboptimal graph topology construction due to fixed or heuristic-based edge definitions, 2) inefficient propagation of discriminative node features across heterogeneous regions, and 3) inadequate fusion of spatially correlated and spectrally discriminative patterns. To overcome these chal",SSCGNN,GCN,Not Disscused,"HSI, This, Hyperspectral, Each, Pavia, Salinas, WHU-Hi-HanChuan, WHU-Hi-LongKou",Not Disscused,,Benchmark,Healthcare,Not Disscused,"SIGMOID, SOFTMAX",Introduce non-linearity,Contrastive loss,Adam/AdamW,"Node classification, Classification",CNN,"Sum, Max, Attention","Sum, Max, Attention","Semi-supervised, Contrastive, Supervised",Normalization,Not Disscused,Not Disscused,BatchNorm,Not Disscused,Not Disscused,"Sum, Max, Attention",Not Disscused,Not Disscused,GCN,Not Disscused,Yes,Yes,Yes,Yes,"Semi-supervised, Contrastive, Supervised","Heterogeneous, Temporal/Dynamic","GCN, CNN, Transformer",IEEE
315,A Drug-Drug Interaction Prediction Method Based on Atomic 3D Position Encoding and Elastic Message Passing Graph Neural Network,2025,IEEE Journal of Biomedical and Health Informatics,Not Disscused,"—Drug-drug interaction (DDI) refers to the in- hibitory or enhancing effects between different drugs. Ex- isting DDI prediction methods primarily use graph neural networks (GNNs) to directly represent drug molecular fea- tures. However, they often ignore the 3D structures of dif- ferent atoms within drug molecules and the impact of noise in GNNs on DDI prediction. Consequently, the accuracy of GNN-based DDI prediction remains unsatisfactory. To address these limitations, this study proposes a DD",Not Disscused,"GCN, MPNN/message passing",Not Disscused,"DDI, ChCh-Miner",Not Disscused,,Real-world,Healthcare,Not Disscused,"SIGMOID, SOFTMAX",Introduce non-linearity,"Cross-Entropy, Binary Cross-Entropy, Contrastive loss",Not Disscused,"Link prediction/classification, Recommendation",CNN,"Mean, Sum, Max, Attention","Mean, Sum, Max, Attention","Semi-supervised, Contrastive, Supervised",Not Disscused,Not Disscused,PyTorch,Not Disscused,Not Disscused,Not Disscused,"Mean, Sum, Max, Attention",Not Disscused,Not Disscused,"GCN, MPNN/message passing",Not Disscused,Yes,Yes,Yes,Not Disscused,"Semi-supervised, Contrastive, Supervised","Temporal/Dynamic, Knowledge graph","GCN, MLP, CNN",IEEE
316,Graph Neural Network With Directional Information and Global Perception Fusion for UAV Fault Diagnosis,2025,IEEE Sensors Journal,Not Disscused,"—Fault diagnosis is critical to flight safety for multirotor uncrewed aerial vehicles (UAVs). While graph neural networks (GNNs) have shown validity in modeling complex structural data, conventional approaches relying on undirected graphs and local message-passing struggle with graph heterophily and limited receptive fields. To overcome these limitations, this article proposes directional informa- tion and global perception fusion (DIGPGNN)—a novel GNN architecture that integrates for enhanced U",Not Disscused,"GCN, GAT, GIN, HAN, MPNN",Not Disscused,"UAV, Bebop2, F450",Not Disscused,,Real-world,Healthcare,Yes,SOFTMAX,Introduce non-linearity,Cross-Entropy,Adam/AdamW,"Node classification, Prediction",LSTM,"Mean, Sum, Max, Attention","Mean, Sum, Max, Attention","Semi-supervised, Contrastive, Supervised",Weight decay/L2,Not Disscused,PyTorch Geometric,Not Disscused,Not Disscused,Not Disscused,"Mean, Sum, Max, Attention",Not Disscused,Not Disscused,"GCN, GAT, GIN, HAN",Not Disscused,Yes,Yes,Yes,Yes,"Semi-supervised, Contrastive, Supervised","Heterogeneous, Temporal/Dynamic","GCN, GAT, GIN, LSTM, Transformer",IEEE
317,Remaining Useful Life Prediction Through Adaptive Spatiotemporal Graph Neural Network Based on Relationship Mining for Complex Aviation Equipment,2025,IEEE Sensors Journal,Not Disscused,"—The evolution of the aviation industry has led to increased demands for enhanced reliability in aviation equip- ment, underscoring the need for reliable system operations, reduced production costs, and the prevention of unsched- uled downtimes. Traditional maintenance methods, such as fault correction and time-based preventive maintenance, are becoming increasingly inadequate due to the heightened complexity and precision requirements of modern aviation equipment. To this end, an adaptive spati",Not Disscused,"GCN, GAT, Spatio-temporal",Not Disscused,"C-MAPSS, This",Not Disscused,,Real-world,Healthcare,Yes,"LEAKYRELU, SOFTMAX",Introduce non-linearity,MSE,SGD,"Prediction, Classification","CNN, LSTM, GRU","Mean, Sum, Max, Attention","Mean, Sum, Max, Attention","Semi-supervised, Supervised",Weight decay/L2,Not Disscused,PyTorch,Not Disscused,Yes,Not Disscused,"Mean, Sum, Max, Attention",Not Disscused,Not Disscused,"GCN, GAT, Spatio-temporal",Not Disscused,Yes,Yes,Yes,Yes,"Semi-supervised, Supervised","Heterogeneous, Temporal/Dynamic","GCN, GAT, CNN, LSTM, GRU",IEEE
318,Geometric Algebra Multi-Order Graph Neural Network for Traffic Prediction,2025,IEEE Transactions on Big Data,Not Disscused,"—Accurate trafﬁc prediction is crucial for urban traf- ﬁc management. Spatial-temporal graph neural networks, which combine graph neural networks with time series processing, have been extensively employed in trafﬁc prediction. However, tradi- tional graph neural networks only capture pairwise spatial re- lationships between road network nodes, neglecting high-order interactions among multiple nodes. Meanwhile, most work for extracting temporal dependencies suffers from implicit modeling and ove",Proposed model (name not captured),"GCN, Hypergraph, Spatio-temporal, STGCN",Not Disscused,"METR-LA, PEMS-BAY, PEMS08",Not Disscused,,Real-world,Transportation/Traffic,Not Disscused,"ReLU, TANH, SOFTMAX",Introduce non-linearity,MAE,Adam/AdamW,"Prediction, Classification","CNN, LSTM, GRU","Mean, Sum, Max, Attention","Mean, Sum, Max, Attention","Self-supervised, Federated, Supervised",Early stopping,Not Disscused,Not Disscused,Not Disscused,Yes,Not Disscused,"Mean, Sum, Max, Attention",Not Disscused,Not Disscused,"GCN, Hypergraph, Spatio-temporal, STGCN",Not Disscused,Yes,Yes,Yes,Yes,"Self-supervised, Federated, Supervised","Temporal/Dynamic, Hypergraph","GCN, MLP, CNN, LSTM, GRU, Random Forest",IEEE
319,CSCL-GNN: Cross-View Semantic Contrastive Learning and Graph Neural Networks for Event Recommendation in Event-Based Social Networks,2025,IEEE Transactions on Consumer Electronics,Not Disscused,"—Event-based social networks (EBSNs) connect users through shared interests in real-world events. These platforms allow users to discover, join, and interact around events, but their complex relationships make accurate recommendations challenging. Traditional methods often modify network structures (e.g., randomly removing connections), risking information loss or noise injection, which harms model accuracy. Additionally, they ignore users with similar interests but weak social ties. To solve th",Proposed model (name not captured),"GCN, GAT, GraphSAGE, GIN, HAN",Not Disscused,"Yelp, Meetup, CiaoDVD, AUB, DBLP",Public,https://www.cse.msu.edu/tangjili/datasetcode; https://www.yelp.com/dataset/download; https://tianchi.aliyun.com/dataset/,Real-world,Healthcare,Not Disscused,"SIGMOID, SOFTMAX",Introduce non-linearity,Contrastive loss,Not Disscused,"Recommendation, Prediction",CNN,"Mean, Sum, Max, Attention","Mean, Sum, Max, Attention","Semi-supervised, Self-supervised, Contrastive",Weight decay/L2,Not Disscused,Not Disscused,Not Disscused,Yes,Not Disscused,"Mean, Sum, Max, Attention",Not Disscused,Not Disscused,"GCN, GAT, GraphSAGE, GIN",Not Disscused,Yes,Not Disscused,Yes,Not Disscused,"Semi-supervised, Self-supervised, Contrastive","Heterogeneous, Temporal/Dynamic, Knowledge graph, Hypergraph, Homogeneous","GCN, GAT, GraphSAGE, GIN, Transformer, LightGCN",IEEE
320,CausalSeqGNN: A Fama-French Inspired Fuzzy Cognitive Map Combined With Graph Neural Network for Stock Prediction,2025,IEEE Transactions on Fuzzy Systems,Not Disscused,"—Accurate stock prediction is a pressing challenge in quantitative ﬁnance, where complex temporal and cross-sectional dynamics defy traditional models. Although deep learning-based methods have made signiﬁcant progress, most of them focus on individual stock trajectories, neglecting directional causality in stock interactions. Fuzzy cognitive maps (FCMs) are good at mod- eling the directional causality. Therefore, we design a new type of FCM with each concept node having a fuzzy state vector ins",Not Disscused,"GCN, GAT",Not Disscused,"ACL18, CMIN-US, CMIN-CN",Not Disscused,,Real-world,Healthcare,Not Disscused,"ReLU, LEAKYRELU, TANH, SIGMOID, SOFTMAX",Introduce non-linearity,"MSE, MAE",Adam/AdamW,"Recommendation, Prediction","BERT, CNN, LSTM","Mean, Sum, Max, Attention","Mean, Sum, Max, Attention","Semi-supervised, Supervised",Weight decay/L2,Not Disscused,PyTorch Geometric,Not Disscused,Not Disscused,Not Disscused,"Mean, Sum, Max, Attention",Not Disscused,Not Disscused,"GCN, GAT",Not Disscused,Yes,Not Disscused,Yes,Yes,"Semi-supervised, Supervised",Temporal/Dynamic,"GCN, GAT, MLP, CNN, LSTM, BERT",IEEE
321,Decoding Gestures in Electromyography: Spatiotemporal Graph Neural Networks for Generalizable and Interpretable Classification,2025,IEEE Transactions on Neural Systems and Rehabilitation Engineering,Not Disscused,"— In recent years, significant strides in deep learning have propelled the advancement of electromyogra- phy (EMG)-based upper-limb gesture recognition systems, yielding notable successes across a spectrum of domains, including rehabilitation, orthopedics, robotics, and human- computer interaction. Despite these achievements, prevail- ing methodologies often overlook the intrinsic physical configurations and interconnectivity of multi-channel sen- sory inputs, resulting in a failure to adequatel",Proposed model (name not captured),"GCN, GAT, GraphSAGE, MPNN, MPNN/message passing",Not Disscused,"CapgMyo, EMG, EEG, This, BandMyo, Each, DATASETS, UCI",Public,,Real-world,Healthcare,Yes,GELU,Introduce non-linearity,Cross-Entropy,Not Disscused,"Node classification, Prediction","CNN, LSTM","Mean, Sum, Max, Attention","Mean, Sum, Max, Attention","Supervised, Unsupervised","Dropout, Weight decay/L2, Normalization",Not Disscused,Not Disscused,BatchNorm,Not Disscused,Not Disscused,"Mean, Sum, Max, Attention",Yes,Regularization,"GCN, GAT, GraphSAGE, MPNN",Not Disscused,Yes,Yes,Yes,Yes,"Supervised, Unsupervised",Temporal/Dynamic,"GCN, GAT, CNN, LSTM",IEEE
