226,Energy Consumption Prediction for Manufacturing in Industrial IoT Based on Heterogeneous GNN,2024,2024 IEEE/CIC International Conference on Communications in China (ICCC),Not Disscused,"—Energy consumption prediction plays a crucial role in green manufacturing for industry, providing a theoretical foundation for energy-saving planning, workshop scheduling, and process optimization. However, owing to the processing complex- ity of mechanical products and the multiplicity of production information, previous methods can only achieve prediction for individual devices, which are quite restrictive to collaborative manufacturing planning. To deal with product-level energy management, ",Not Disscused,"GCN, GAT, HAN, Spatio-temporal",Not Disscused,Not Disscused,Not Disscused,Not Disscused,Not Disscused,Healthcare,Not Disscused,ReLU,Introduce non-linearity,MAE,Not Disscused,"Link prediction/classification, Prediction","LSTM, GRU","Mean, Sum, Max, Attention","Mean, Sum, Max, Attention",Not Disscused,Not Disscused,Not Disscused,Not Disscused,Not Disscused,Not Disscused,Not Disscused,"Mean, Sum, Max, Attention",Not Disscused,Not Disscused,"GCN, GAT, HAN, Spatio-temporal",Not Disscused,Yes,Yes,Yes,Not Disscused,Not Disscused,"Heterogeneous, Temporal/Dynamic, Homogeneous","GCN, GAT, MLP, LSTM, GRU",IEEE
227,Prevention of Data Privacy and Recommendations using Federated Graph Neural Network,2024,"2024 International Conference on Advances in Computing, Communication and Materials (ICACCM)",Not Disscused,"One type of distributed learning that makes use of  edge devices for training is called federated learning. By keeping  the real data on the users' devices and transmitting the learning  parameters and gradient updates to the global server during the  training process, it seeks to protect users' privacy. Instead of  using user data directly, the global server uses these parameters  for training, and the client's devices can be used for local model  tuning. In this thesis, we provide an overview ",Not Disscused,GCN,Not Disscused,Not Disscused,Public,Not Disscused,Benchmark,Transportation/Traffic,Yes,Not Disscused,Not Disscused,MAE,Not Disscused,"Recommendation, Prediction",Not Disscused,"Mean, Sum","Mean, Sum",Federated,Not Disscused,Not Disscused,Not Disscused,Not Disscused,Not Disscused,Not Disscused,"Mean, Sum",Not Disscused,Not Disscused,GCN,Not Disscused,Not Disscused,Yes,Yes,Not Disscused,Federated,"Heterogeneous, Temporal/Dynamic, Knowledge graph, Homogeneous",GCN,IEEE
228,Hierarchical Social Recommendation Based on Federated Graph Neural Network,2024,2024 International Conference on Artificial Intelligence and Digital Libraries (AIDL),Not Disscused,"—As social media has grown, personalized social  recommendation  systems  have  become  increasingly  essential.Research indicates that integrating social information  significantly enhances recommendation accuracy and user  experience. However, challenges arise from expanding social  networks and privacy regulations, necessitating a focus on privacy  preservation and computational resource optimization. We  propose a hierarchical architecture-based federated learning  social recommendation syst",Not Disscused,"GAT, GraphSAGE",Not Disscused,"Ciao, Epinions",Public,Not Disscused,Real-world,Healthcare,Yes,Not Disscused,Not Disscused,MAE,Not Disscused,"Recommendation, Prediction",CNN,"Mean, Sum, Attention","Mean, Sum, Attention",Federated,Not Disscused,Not Disscused,Not Disscused,Not Disscused,Not Disscused,Not Disscused,"Mean, Sum, Attention",Not Disscused,Not Disscused,"GAT, GraphSAGE",Not Disscused,Yes,Not Disscused,Yes,Not Disscused,Federated,Temporal/Dynamic,"GAT, LightGCN",IEEE
229,Self-Organized Graph Neural Network with Adaptive Boosting Support Vector Regression Prediction Model for Smart Traffic Management System,2024,2024 International Conference on Integrated Intelligence and Communication Systems (ICIICS),Not Disscused,—Advancement in technology has led path for  automated road traffic management software in order to  minimize the road traffic. The prediction of road traffic helps to  maintain the harmony in the society. The existing model failed  to predict appropriate road traffic due to lack of data pre- process and feature extraction ability that affected the smart  traffic management system. To Self-Organized Graph Neural  Network with Adaptive Boosting Support Vector Regression  (SOGNN-ABSVR)  is  propos,Not Disscused,"GCN, HAN",Not Disscused,"PeMS, PEMS-BAY, NYC, PeMS-Bay, Taxi",Public,https://www.kaggle.com/datasets/elemento/nyc-yellow-taxi-trip-data; https://www.kaggle.com/datasets/scchuy/pemsbay,Not Disscused,Transportation/Traffic,Not Disscused,SOFTMAX,Introduce non-linearity,MAE,Not Disscused,"Prediction, Classification","CNN, LSTM, GRU","Mean, Max, Attention","Mean, Max, Attention",Not Disscused,Not Disscused,Not Disscused,Not Disscused,Not Disscused,Not Disscused,Not Disscused,"Mean, Max, Attention",Not Disscused,Not Disscused,"GCN, HAN",Not Disscused,Yes,Yes,Yes,Not Disscused,Not Disscused,"Heterogeneous, Temporal/Dynamic","GCN, LSTM, GRU, Transformer",IEEE
230,A Dynamic Dual-Graph Neural Network for Stock Price Movement Prediction,2024,2024 International Joint Conference on Neural Networks (IJCNN),Not Disscused,"—The prediction of stock price movements is chal- lenging due to the inherently dynamic and complex character- istics of financial markets. A current research gap is the lack of exploration into the complex interrelationships inherent in stock price dynamics, often analyzing predictions in isolation with an implicit presumption that solely the historical data of a given stock influences its future trend. However, stock prices are impacted by a diverse array of driving factors that extend beyond ",Proposed model (name not captured),"GCN, GAT",Not Disscused,"EDT, This, BIGDATA22, CIKM18",Public,https://www.wikidata.org/wiki/Wikidata:List,Real-world,Healthcare,Yes,"ReLU, LEAKYRELU, TANH, SOFTMAX",Introduce non-linearity,Cross-Entropy,Adam/AdamW,"Prediction, Classification","BERT, word2vec, CNN, LSTM","Mean, Sum, Max, Attention","Mean, Sum, Max, Attention","Self-supervised, Supervised","Dropout, Normalization",Not Disscused,Not Disscused,BatchNorm,Not Disscused,Not Disscused,"Mean, Sum, Max, Attention",Yes,Regularization,"GCN, GAT",Not Disscused,Yes,Not Disscused,Yes,Not Disscused,"Self-supervised, Supervised","Temporal/Dynamic, Knowledge graph","GCN, GAT, MLP, SVM, CNN, LSTM, Random Forest, BERT",IEEE
231,A Network Latency Prediction Method Based on Sequence Decomposition and GNN,2024,2024 International Joint Conference on Neural Networks (IJCNN),Not Disscused,"—Ultra reliable low latency communication (URLLC) has emerged as a crucial element in various communication services due to its ability to provide highly dependable and real- time connections. However, existing time series models utilized in URLLC scenarios often overlook the interconnections among delay cycles, trends, and bursts. Therefore, they fail to effectively capture the temporal periodic statistical characteristics exhibited by real data. To address this limitation, we propose a network",Proposed model (name not captured),"GIN, MPNN/message passing",Not Disscused,"URLLC, PCudp, WSLudp, PCtcp",Not Disscused,Not Disscused,Real-world,Transportation/Traffic,Not Disscused,Not Disscused,Not Disscused,"MSE, MAE",Not Disscused,"Prediction, Classification","CNN, LSTM","Mean, Sum, Max","Mean, Sum, Max",Contrastive,Normalization,Not Disscused,PyTorch,BatchNorm,Not Disscused,Not Disscused,"Mean, Sum, Max",Not Disscused,Not Disscused,"GIN, MPNN/message passing",Not Disscused,Not Disscused,Not Disscused,Yes,Yes,Contrastive,Temporal/Dynamic,"GIN, MLP, CNN, LSTM, Transformer",IEEE
232,Collaborative Graph Neural Networks with Contrastive Learning for Sequential Recommendation,2024,2024 International Joint Conference on Neural Networks (IJCNN),Not Disscused,"—Sequential recommendations aim to exploit user purchase records to predict the next items they will buy. Although the problem has been extensively investigated, most existing methods model user interests based only on their own historical sequences but ignore the collaboration with others. Additionally, user behaviors are often implicit and contain noise that cannot fully reflect their preferences. Furthermore, since user preferences can evolve over time, capturing their interests from past beh",Proposed model (name not captured),"GCN, Hypergraph",Not Disscused,"Amazon, Games, Amazon-Games",Public,http://jmcauley.ucsd.edu/data/amazon,Real-world,Healthcare,Yes,ReLU,Introduce non-linearity,Contrastive loss,Adam/AdamW,"Recommendation, Prediction","CNN, LSTM, GRU","Mean, Sum, Max, Attention","Mean, Sum, Max, Attention","Self-supervised, Contrastive, Supervised",Not Disscused,Not Disscused,Not Disscused,Not Disscused,Yes,Not Disscused,"Mean, Sum, Max, Attention",Not Disscused,Not Disscused,"GCN, Hypergraph",Not Disscused,Yes,Not Disscused,Yes,Not Disscused,"Self-supervised, Contrastive, Supervised","Temporal/Dynamic, Knowledge graph, Hypergraph","GCN, CNN, LSTM, GRU, LightGCN",https://github.com/tabo0/CCGNN.
233,Recommender Systems with Graph Neural Networks: A Comparative Study,2024,2024 Mediterranean Smart Cities Conference (MSCC),Not Disscused,"— In this paper, we conduct a comprehensive  evaluation of four variations of graph neural networks  (GNNs) - GCN, LightGCN, GraphSAGE, and NGCF - for  the development of recommendation systems based on link  prediction. Leveraging the MovieLens 100K dataset [3],  consisting of 100,000 ratings from 1000 users on 1700  movies, we explore the performance of these GNN models in  capturing user-item interactions and generating accurate  recommendations. Our study focuses on transforming  explicit us",Not Disscused,"GCN, GraphSAGE",Not Disscused,"MovieLens, Sparse",Not Disscused,Not Disscused,Real-world,Healthcare,Yes,Not Disscused,Not Disscused,Not Disscused,SGD,"Recommendation, Prediction",Not Disscused,"Mean, Sum, Max","Mean, Sum, Max",Inductive,Dropout,Not Disscused,Not Disscused,Not Disscused,Not Disscused,Not Disscused,"Mean, Sum, Max",Yes (0.1),Regularization,"GCN, GraphSAGE",Not Disscused,Not Disscused,Not Disscused,Yes,Not Disscused,Inductive,Temporal/Dynamic,"GCN, GraphSAGE, LightGCN",IEEE
234,Noise-Resistant Graph Neural Network for Node Classification,2024,"ICASSP 2024 - 2024 IEEE International Conference on Acoustics, Speech and Signal Processing (ICASSP)",Not Disscused,"Graph neural networks (GNNs) have achieved promising results for node classification tasks. However, due to the memorization effects, GNNs easily overfit in the presence of label noise. Currently, this problem remains open. In this paper, we propose CLaSS to bridge this important gap. It is a first-of-its-kind sample selection-based framework for training noise-resistant GNNs. Specifically, CLaSS per- forms graph contrastive learning to improve the robustness of GNNs and effectively leverages un",Proposed model (name not captured),"GCN, HAN",Not Disscused,"Amazon, Coauthor-CS, Amazon-Computers",Not Disscused,Not Disscused,Real-world,Healthcare,Yes,Not Disscused,Not Disscused,"Cross-Entropy, MSE",Adam/AdamW,"Node classification, Prediction",Not Disscused,"Mean, Sum, Max","Mean, Sum, Max","Semi-supervised, Self-supervised, Contrastive",Not Disscused,Not Disscused,Not Disscused,Not Disscused,Not Disscused,Not Disscused,"Mean, Sum, Max",Not Disscused,Not Disscused,"GCN, HAN",Not Disscused,Not Disscused,Not Disscused,Not Disscused,Not Disscused,"Semi-supervised, Self-supervised, Contrastive",Not Disscused,GCN,IEEE
235,Detecting Side Effects of Adverse Drug Reactions Through Drug-Drug Interactions Using Graph Neural Networks and Self-Supervised Learning,2024,IEEE Access,Not Disscused,"Adverse Drug Reactions(ADRs) due to drug-drug interactions present a public health problem worldwide that deserves attention due to its impact on mortality, morbidity, and healthcare costs. There have been major challenges in healthcare with the ever-increasing complexity of therapeutics and an aging population in many regions. At present, no standard method to detect such adverse drug reactions exists until otherwise reported by patients after the drug is released to the market. Further, severa",Not Disscused,"GCN, GAT, GraphSAGE",Not Disscused,DrugBank,Not Disscused,,Benchmark,Healthcare,Yes,"ReLU, SIGMOID, SOFTMAX",Introduce non-linearity,NLL,Adam/AdamW,"Recommendation, Prediction","CNN, LSTM","Mean, Sum, Max, Attention","Mean, Sum, Max, Attention","Self-supervised, Inductive, Transductive","Dropout, Weight decay/L2, Normalization",Global mean pooling,PyTorch,BatchNorm,Not Disscused,Global mean pooling,"Mean, Sum, Max, Attention",Yes,Regularization,"GCN, GAT, GraphSAGE",Not Disscused,Yes,Yes,Yes,Yes,"Self-supervised, Inductive, Transductive","Heterogeneous, Temporal/Dynamic, Knowledge graph","GCN, GAT, GraphSAGE, MLP, SVM, LSTM",IEEE
236,SR-DSGA: Session Recommendation for Dual Sequence Based on Graph Neural Network and Multi-Attention,2024,IEEE Access,Not Disscused,"Session recommender system (SRS) captures user’s sequential features based on historical behavior to predict the next-clicked item. The accuracy of extracting user’s session features directly determines the key performance of SRS. Existing session recommendation methods have two flaws: 1) ignore the complex connections between items, i.e. represent them in a relatively isolated manner; 2) neglect the transition patterns between attributes of items. To address these issues, we propose a novel ses",Proposed model (name not captured),"GCN, MPNN/message passing",Not Disscused,Diginetica,Not Disscused,,Real-world,Healthcare,Yes,"ReLU, TANH, SIGMOID, SOFTMAX",Introduce non-linearity,Cross-Entropy,Not Disscused,"Recommendation, Prediction",GRU,"Mean, Sum, Max, Attention","Mean, Sum, Max, Attention",Not Disscused,Normalization,Not Disscused,PyTorch,LayerNorm,Not Disscused,Not Disscused,"Mean, Sum, Max, Attention",Not Disscused,Not Disscused,"GCN, MPNN/message passing",Not Disscused,Yes,Not Disscused,Yes,Not Disscused,Not Disscused,"Heterogeneous, Temporal/Dynamic","GCN, GRU, Transformer",IEEE
237,3-D Ocean Temperature Prediction via Graph Neural Network With Optimized Attention Mechanisms,2024,IEEE Geoscience and Remote Sensing Letters,Not Disscused,"— Ocean temperature prediction plays crucial roles in the ocean-related fields. The graph neural networks (GNNs) show advantages for modeling complex environmental issues. However, the prior methods typically focus on node features to predict ocean temperature. Note that the edge features are essential, especially for 3-D ocean temperature prediction. In this letter, a GNN with optimized attention mechanisms (GNN-OAMs) model is proposed to predict 3-D ocean temperature. The GNN-OAM introduces a ",Not Disscused,Spatio-temporal,Not Disscused,Not Disscused,Not Disscused,,Not Disscused,Healthcare,Not Disscused,Not Disscused,Not Disscused,"MSE, MAE",Not Disscused,"Prediction, Classification","CNN, LSTM","Mean, Max, Attention","Mean, Max, Attention",Not Disscused,Not Disscused,Not Disscused,PyTorch,Not Disscused,Not Disscused,Not Disscused,"Mean, Max, Attention",Not Disscused,Not Disscused,Spatio-temporal,Not Disscused,Yes,Yes,Yes,Yes,Not Disscused,Temporal/Dynamic,"CNN, LSTM",IEEE
238,A Recurrent Spatio-Temporal Graph Neural Network Based on Latent Time Graph for Multi-Channel Time Series Forecasting,2024,IEEE Signal Processing Letters,Not Disscused,"—With the advancement of technology, the ﬁeld of multi-channel time series forecasting has emerged as a focal point of research. In this context, spatio-temporal graph neural net- works have attracted signiﬁcant interest due to their outstanding performance. An established approach involves integrating graph convolutional networks into recurrent neural networks. However, this approach faces difﬁculties in capturing dynamic spatial corre- lations and discerning the correlation of multi-channel ti",Proposed model (name not captured),"GCN, GAT, HGT, Spatio-temporal, STGCN",Not Disscused,PEMS08,Public,,Benchmark,Healthcare,Not Disscused,"ReLU, GELU, SIGMOID, SOFTMAX",Introduce non-linearity,MAE,Not Disscused,"Prediction, Classification","CNN, LSTM, GRU","Mean, Max, Attention","Mean, Max, Attention","Semi-supervised, Supervised",Not Disscused,Not Disscused,Not Disscused,Not Disscused,Not Disscused,Not Disscused,"Mean, Max, Attention",Not Disscused,Not Disscused,"GCN, GAT, HGT, Spatio-temporal",Not Disscused,Yes,Yes,Yes,Yes,"Semi-supervised, Supervised",Temporal/Dynamic,"GCN, GAT, CNN, LSTM, GRU",IEEE
239,GNN-IR: Examining graph neural networks for influencer recommendations in social media marketing,2024,Journal of Retailing and Consumer Services,Korea,"This inﬂuence spawned the concept of inﬂuencer marketing, where companies leverage these personalities to advertise their products. YouTube stands out as a prominent platform in this trend.",GNN-IR,"GAT, GCN, GraphSAGE",Not Disscused,"China, For, GNN-IR, Shrimp, Then, TripAdvisor, Utilizing, YouTube",Public,https://github,Benchmark,Recommendation,Not Disscused,"ELU, ReLU",Non-linear transformation,"Cross-Entropy, BCE",Adam,Recommendation,Not Disscused,Attention,Attention,Semi-supervised,Not Disscused,Pooling (mentioned),"PyTorch Geometric, PyTorch",Not Disscused,Not Disscused,Not Disscused,Not Disscused,Not Disscused,Not Disscused,"GAT, GCN, GNN (unspecified), Graph Transformer, GraphSAGE, Heterogeneous GNN, MPNN",Not Disscused,Yes,Not Disscused,Yes,Not Disscused,?,heterogeneous,Not Disscused,IEEE
240,Real-Time Seismic Intensity Prediction Using Self-Supervised Contrastive GNN for Earthquake Early Warning,2024,IEEE Transactions on Geoscience and Remote Sensing,Not Disscused,"— Seismic intensity prediction from early or initial seismic waves received by a few seismic stations can enhance earthquake early warning systems (EEWSs), particularly in ground motion-based approaches like propagation of local undamped motion (PLUM). While many operational EEWSs currently utilize point-source-based models that estimate the warning area based on magnitude and distance measures, direct intensity prediction offers a potential improvement in accuracy and reliability. In this artic",Proposed model (name not captured),"GCN, GAT, MPNN/message passing",Not Disscused,"This, STEAD",Not Disscused,,Real-world,Healthcare,Yes,ReLU,Introduce non-linearity,"MSE, MAE, Contrastive loss",Adam/AdamW,"Prediction, Classification","CNN, LSTM","Mean, Sum, Max, Attention","Mean, Sum, Max, Attention","Self-supervised, Contrastive, Inductive","Dropout, Normalization",Not Disscused,TensorFlow/Keras,BatchNorm,Not Disscused,Not Disscused,"Mean, Sum, Max, Attention",Yes,Regularization,"GCN, GAT, MPNN/message passing",Not Disscused,Yes,Yes,Yes,Yes,"Self-supervised, Contrastive, Inductive",Temporal/Dynamic,"GCN, GAT, MLP, SVM, CNN, LSTM",IEEE
241,Adversarial Graph Neural Network for Multivariate Time Series Anomaly Detection,2024,IEEE Transactions on Knowledge and Data Engineering,Not Disscused,"—Anomaly detection is one of the most signiﬁcant tasks in multivariate time series analysis, while it remains challenging to model complex patterns for improving detection accuracy and to interpret the root causes of anomalies. However, existing studies either consider only the temporal dependencies, or simply recon- structtheoriginalinputfordetection,bothneglectingthehiddenre- lationships among multivariate. We propose an adversarial graph neural network based anomaly detection model, called SG",Proposed model (name not captured),"GAT, HAN, Spatio-temporal, STGCN",Not Disscused,"SWaT, MSL, WADI",Public,https://itrust.sutd.edu.sg/itrust-labs_datasets/dataset_info/#wadi,Real-world,Healthcare,Not Disscused,"TANH, SIGMOID, SOFTMAX",Introduce non-linearity,Contrastive loss,Adam/AdamW,"Prediction, Classification","CNN, LSTM, GRU","Mean, Sum, Max, Attention","Mean, Sum, Max, Attention","Contrastive, Supervised, Unsupervised","Dropout, Weight decay/L2",Not Disscused,Not Disscused,Not Disscused,Not Disscused,Not Disscused,"Mean, Sum, Max, Attention",Yes,Regularization,"GAT, HAN, Spatio-temporal, STGCN",Not Disscused,Yes,Yes,Yes,Yes,"Contrastive, Supervised, Unsupervised",Temporal/Dynamic,"GAT, CNN, LSTM, GRU, Transformer",https://github.com/JulienAu/Anomaly_Detection_Tuto
242,Graph neural network-based surrogate modelling for real-time hydraulic prediction of urban drainage networks,2024,Water Research,China,"Urban drainage network Graph neural network Surrogate modelling Hydraulic prediction A B S T R A C T Physics-based models are computationally time-consuming and infeasible for real-time scenarios of urban drainage networks, and a surrogate model is needed to accelerate the online predictive modelling. Fully- connected neural networks (NNs) are potential surrogate models, but may suffer from low in",Not Disscused,GAT,Not Disscused,"After, Effects, GNN-fusion, GNN-individual, NN-fusion, NN-individual",Public,https://doi.org/10.1016/j.watres.2024.122142,Benchmark,Water/Urban drainage,Not Disscused,"ELU, ReLU, Sigmoid",Non-linear transformation,"Cross-Entropy, BCE, MSE, RMSE",Adam,Prediction,Not Disscused,Attention,Attention,Supervised,Not Disscused,Not Disscused,"TensorFlow, Keras",Not Disscused,Not Disscused,Not Disscused,Not Disscused,Not Disscused,Not Disscused,"GAT, GCN, GNN (unspecified), Heterogeneous GNN, MPNN",Not Disscused,Yes,Yes,Yes,Not Disscused,supervised,"heterogeneous, dynamic/temporal",Not Disscused,IEEE
243,Reconstructed Graph Neural Network With Knowledge Distillation for Lightweight Anomaly Detection,2024,IEEE Transactions on Neural Networks and Learning Systems,Not Disscused,"— The proliferation of Internet-of-Things (IoT) tech- nologies in modern smart society enables massive data exchange for offering intelligent services. It becomes essential to ensure secure communications while exchanging highly sensitive IoT data efficiently, which leads to high demands for lightweight mod- els or algorithms with limited computation capability provided by individual IoT devices. In this study, a graph representation learning model, which seamlessly incorporates graph neural net",Not Disscused,"GCN, GAT",Not Disscused,CIC-DDoS2019,Public,,Real-world,Transportation/Traffic,Not Disscused,SOFTMAX,Introduce non-linearity,Cross-Entropy,Not Disscused,"Prediction, Classification",Not Disscused,"Mean, Sum, Max, Attention","Mean, Sum, Max, Attention","Semi-supervised, Self-supervised, Contrastive",Not Disscused,Not Disscused,Not Disscused,Not Disscused,Not Disscused,Not Disscused,"Mean, Sum, Max, Attention",Not Disscused,Not Disscused,"GCN, GAT",Not Disscused,Yes,Not Disscused,Yes,Not Disscused,"Semi-supervised, Self-supervised, Contrastive","Heterogeneous, Temporal/Dynamic","GCN, GAT, MLP",IEEE
244,${\sf PROPHET}$PROPHET: Explainable Predictive Process Monitoring With Heterogeneous Graph Neural Networks,2024,IEEE Transactions on Services Computing,Not Disscused,"—In this article, we introduce PROPHET, an innova- tive approach to predictive process monitoring based on Heteroge- neous Graph Neural Networks. PROPHET is designed to strike a balance between accurate predictions and interpretability, partic- ularly focusing on the next-activity prediction task. For this pur- pose, we represent the event traces recorded for different business process executions as heterogeneous graphs within a multi-view learning scheme combined with a heterogeneous graph lear",PROPHET,"GCN, GAT",Not Disscused,Not Disscused,Not Disscused,https://data.4tu.nl/portal; https://zenodo.org/records/3928487,Real-world,Healthcare,Not Disscused,"LEAKYRELU, SOFTMAX",Introduce non-linearity,Cross-Entropy,Adam/AdamW,"Link prediction/classification, Prediction","word2vec, CNN, LSTM","Mean, Sum, Max, Attention","Mean, Sum, Max, Attention",Supervised,Dropout,Not Disscused,DGL,Not Disscused,Yes,Not Disscused,"Mean, Sum, Max, Attention",Yes,Regularization,"GCN, GAT",Not Disscused,Yes,Not Disscused,Yes,Yes,Supervised,"Heterogeneous, Temporal/Dynamic, Homogeneous","GCN, GAT, CNN, LSTM, XGBoost, Random Forest, Transformer",https://github.com/vinspdb/PROPHET
245,Collaborative Tag-Aware Graph Neural Network for Long-Tail Service Recommendation,2024,IEEE Transactions on Services Computing,Not Disscused,"—Long-tail service recommendation provides an unex- pected but reasonable experience for potential developers when they construct mashups. However, the lack of available information makes it difﬁcult to recommend highly relevant long-tail services for target mashups. Collaborative tagging systems employ exten- sive tag records to replenish the available information of long-tail services, whereas existing tag-aware approaches are unable to learn multi-aspect embeddings from graphs with different ",Proposed model (name not captured),"GCN, HAN",Not Disscused,"ProWeb2020, ProWeb2014, ProgrammableWeb",Not Disscused,,Real-world,Healthcare,Not Disscused,"ReLU, TANH, SOFTMAX",Introduce non-linearity,Not Disscused,Not Disscused,"Recommendation, Prediction",Not Disscused,"Mean, Sum, Max, Attention","Mean, Sum, Max, Attention",Not Disscused,"Dropout, Weight decay/L2",Not Disscused,Not Disscused,Not Disscused,Not Disscused,Not Disscused,"Mean, Sum, Max, Attention",Yes,Regularization,"GCN, HAN",Not Disscused,Yes,Yes,Yes,Not Disscused,Not Disscused,"Heterogeneous, Temporal/Dynamic, Knowledge graph, Homogeneous","GCN, SVM",IEEE
