169,Traffic Flow Prediction Using Spatio-Temporal Graph Neural Networks Based on Hybrid Adaptive Feature Enhancement,2025,Proceedings of the 2025 International Conference on Machine Learning and Neural Networks,Not Disscused,"Aiming at the poor adaptation of most current models to dynamic maps and the difficulty in capturing long-term spatio-temporally relevant features, this paper proposes a hybrid adaptive feature- enhanced graph neural network (HAFEGNN) model. To address these challenges, we propose a new approach based on graph neu- ral networks that integrates multiple state-of-the-art enhancement feature representation mechanisms. The model enhances the repre- sentation of dynamic spatio-temporal features by in",Proposed model (name not captured),"GCN, GAT, HAN, Spatio-temporal, STGCN",Not Disscused,"PeMS, PeMS08, PeMS04",Public,,Real-world,Transportation/Traffic,Yes,"ReLU, LEAKYRELU, SIGMOID, SOFTMAX",Introduce non-linearity,"MSE, MAE",Adam/AdamW,"Prediction, Classification","CNN, GRU","Mean, Sum, Max, Attention","Mean, Sum, Max, Attention",Not Disscused,"Early stopping, Normalization",Global mean pooling,PyTorch,BatchNorm,Yes,Global mean pooling,"Mean, Sum, Max, Attention",Not Disscused,Not Disscused,"GCN, GAT, HAN, Spatio-temporal",Not Disscused,Yes,Yes,Yes,Not Disscused,Not Disscused,Temporal/Dynamic,"GCN, GAT, SVM, CNN, GRU",ACM
170,KEGNN: Knowledge-Enhanced Graph Neural Networks for User Engagement Prediction,2025,Proceedings of the 2025 International Conference on Multimedia Retrieval,Not Disscused,"Accurate user engagement prediction is critical to the success of crowdsourcing in online communities. This study focuses on an- alyzing user behavior in crowd-driven platforms, addressing the challenge of predicting engagement levels based on behavioral dy- namics in online knowledge-sharing environments. We propose a comprehensive framework, Knowledge-Enhanced Graph Neural Networks (KEGNN), which begins by collecting and refining user activity data from a real-world platform and quantifying us",Proposed model (name not captured),"GCN, Spatio-temporal",Not Disscused,Not Disscused,Not Disscused,,Real-world,Transportation/Traffic,Not Disscused,"ReLU, TANH",Introduce non-linearity,Not Disscused,Adam/AdamW,"Recommendation, Prediction","BERT, LSTM, GRU","Mean, Sum, Max, Attention","Mean, Sum, Max, Attention","Semi-supervised, Supervised","Weight decay/L2, Early stopping",Not Disscused,Not Disscused,Not Disscused,Not Disscused,Not Disscused,"Mean, Sum, Max, Attention",Not Disscused,Not Disscused,"GCN, Spatio-temporal",Not Disscused,Yes,Yes,Yes,Not Disscused,"Semi-supervised, Supervised",Temporal/Dynamic,"GCN, MLP, LSTM, GRU, BERT",https://github.com/charliefanfan/ICMR-GNN
171,Research on Personalized Financial Product Recommendation by Integrating Large Language Models and Graph Neural Networks,2025,Proceedings of the 2025 International Conference on Software Engineering and Computer Applications,Not Disscused,"As fintech expands fast, the relevance of personalization of finan- cial products recommendations has gained ground. Latent pref- erences and complicated relationships between users cannot be modelled with the traditional methods such as collaborative filter- ing or content-based models. Our hypothesis is a hybrid framework that combines large language models (LLMs) with graph neural networks (GNNs). A pre-trained LLM can embed text data (e.g., user reviews) into dense feature vectors, and a het",Not Disscused,"GAT, HAN, MPNN/message passing",Not Disscused,Not Disscused,Not Disscused,,Real-world,Healthcare,Yes,"ReLU, SIGMOID",Introduce non-linearity,Cross-Entropy,Adam/AdamW,"Node classification, Link prediction/classification","BERT, CNN, LSTM","Max, Attention","Max, Attention",Supervised,"Dropout, Early stopping",Not Disscused,Not Disscused,Not Disscused,Not Disscused,Not Disscused,"Max, Attention",Yes,Regularization,"GAT, HAN, MPNN/message passing",Not Disscused,Yes,Yes,Yes,Yes,Supervised,"Heterogeneous, Temporal/Dynamic","GAT, MLP, CNN, LSTM, XGBoost, BERT",ACM
172,FreqPosDyG: Frequency-Enhanced Position-Aware Dynamic Graph Neural Network for Link Prediction,2025,Proceedings of the 2025 International Symposium on Artificial Intelligence and Computational Social Sciences,Not Disscused,"In graph networks dynamic graph link prediction is a core task. It aims to infer potential future links by leveraging historical in- teraction information. This task plays an important role in areas such as social networks and bioinformatics. Existing methods still face challenges in modeling long-term dependencies, handling ir- regular time intervals, and effectively integrating structural and temporal features. Moreover, current frequency-domain enhance- ment methods for non-stationary signals",Proposed model (name not captured),"MPNN/message passing, TGN",Not Disscused,"Reddit, LastFM, Wikipedia, UCI, Enron",Not Disscused,,Real-world,Healthcare,Yes,"ReLU, TANH, SIGMOID, SOFTMAX",Introduce non-linearity,"Binary Cross-Entropy, MSE",Not Disscused,"Link prediction/classification, Recommendation",Not Disscused,"Mean, Sum, Max, Attention","Mean, Sum, Max, Attention","Contrastive, Inductive, Transductive",Not Disscused,Not Disscused,Not Disscused,Not Disscused,Not Disscused,Not Disscused,"Mean, Sum, Max, Attention",Not Disscused,Not Disscused,"MPNN/message passing, TGN",Not Disscused,Yes,Yes,Yes,Yes,"Contrastive, Inductive, Transductive","Temporal/Dynamic, Knowledge graph",Transformer,ACM
173,GraphCAD: Leveraging Graph Neural Networks for Accuracy Prediction Handling Crosstalk-affected Delays,2025,Proceedings of the 2025 International Symposium on Physical Design,Not Disscused,"As chip fabrication technology advances, the capacitive effects be- tween wires have become increasingly pronounced, making crosstalk- induced incremental delay a serious issue. Traditional static timing analysis involves complex and iterative calculations through timing windows, requiring precise alignment of aggressor and victim nets, along with delay and slew estimations, which significantly increase runtime and licensing costs. In our work, we develop a Graph Neural Network framework to pred",Not Disscused,"GCN, GAT, GraphSAGE, Graph Transformer",Not Disscused,Test,Not Disscused,,Real-world,Healthcare,Yes,"ReLU, LEAKYRELU, SOFTMAX",Introduce non-linearity,MSE,Not Disscused,"Prediction, Classification","CNN, LSTM","Mean, Sum, Max, Attention","Mean, Sum, Max, Attention",Inductive,"Dropout, Weight decay/L2",Not Disscused,PyTorch Geometric,Not Disscused,Yes,Readout (unspecified),"Mean, Sum, Max, Attention",Yes,Regularization,"GCN, GAT, GraphSAGE, Graph Transformer",Not Disscused,Yes,Not Disscused,Yes,Not Disscused,Inductive,"Heterogeneous, Temporal/Dynamic","GCN, GAT, GraphSAGE, MLP, CNN, LSTM, Transformer",https://github.com/OpenTimer/Parser-SPEF.
174,Graph Neural Network and Temporal Sequence Integration for AI-Powered Financial Compliance Detection,2025,Proceedings of the 2nd International Conference on Intelligent Computing and Data Analysis,Not Disscused,"This paper proposes a compliance anomaly detection algorithm for financial transaction data, addressing the challenges of behavioral complexity, structural dependence, and strong temporal charac- teristics. The method constructs a dynamic trajectory graph with multi-type edges based on account interactions, providing a unified representation of structural relationships and temporal order in financial transactions. A graph neural network is employed to em- bed node relationships and extract high-",Not Disscused,HAN,Not Disscused,Not Disscused,Public,,Real-world,Transportation/Traffic,Yes,Not Disscused,Not Disscused,Not Disscused,Not Disscused,"Recommendation, Prediction",LSTM,"Sum, Attention","Sum, Attention","Contrastive, Federated, Supervised",Dropout,Not Disscused,Not Disscused,Not Disscused,Not Disscused,Not Disscused,"Sum, Attention",Yes,Regularization,HAN,Not Disscused,Yes,Yes,Yes,Not Disscused,"Contrastive, Federated, Supervised","Heterogeneous, Temporal/Dynamic","LSTM, XGBoost",ACM
175,Multimodal Financial Anomaly Detection in Enterprises Using VAE–Transformer–GNN Hybrid Ensemble Models,2025,Proceedings of the 2nd International Symposium on Integrated Circuit Design and Integrated Systems,Not Disscused,"To enhance enterprises’ ability to identify financial anomalies in complex, multi-source economic environments, this study pro- poses a comprehensive anomaly detection system that integrates structured feature compression, time-series residual modeling, and graph-based structural learning. The system is designed to address challenges posed by weakly labeled, high-dimensional, and tempo- rally evolving financial data. It introduces a cost-sensitive anomaly score ensemble strategy that leverages t",Not Disscused,GNN,Not Disscused,Not Disscused,Not Disscused,,Real-world,Healthcare,Yes,Not Disscused,Not Disscused,Not Disscused,Not Disscused,"Prediction, Classification","CNN, LSTM",Sum,Sum,"Semi-supervised, Self-supervised, Supervised",Not Disscused,Not Disscused,DGL,Not Disscused,Not Disscused,Not Disscused,Sum,Not Disscused,Not Disscused,GNN,Not Disscused,Not Disscused,Not Disscused,Yes,Not Disscused,"Semi-supervised, Self-supervised, Supervised","Heterogeneous, Temporal/Dynamic","LSTM, Transformer",ACM
176,Research and practice of advertisement recommendation algorithm based on graph neural network,2025,Proceedings of the 2nd International Symposium on Integrated Circuit Design and Integrated Systems,Not Disscused,"In order to improve the accuracy and recommendation performance of user interest modeling in advertising recommendation systems, a multi behavior heterogeneous graph recommendation framework based on graph neural networks is constructed. Based on 47398 behavior edges consisting of 18520 users and 13740 advertisement samples, a three-layer graph convolution model with attention mechanism is designed by integrating multidimensional behavior relationships such as clicking, browsing, and purchasing.",Not Disscused,"GCN, GAT",Not Disscused,Not Disscused,Public,,Not Disscused,Healthcare,Yes,LEAKYRELU,Introduce non-linearity,Not Disscused,Adam/AdamW,"Recommendation, Prediction",Not Disscused,"Mean, Sum, Max, Attention","Mean, Sum, Max, Attention","Self-supervised, Supervised",Weight decay/L2,Not Disscused,"DGL, TensorFlow/Keras",Not Disscused,Not Disscused,Not Disscused,"Mean, Sum, Max, Attention",Not Disscused,Not Disscused,"GCN, GAT",Not Disscused,Yes,Not Disscused,Yes,Not Disscused,"Self-supervised, Supervised","Heterogeneous, Temporal/Dynamic, Knowledge graph","GCN, GAT",ACM
177,ParaFormer: A Hybrid Graph Neural Network and Transformer Approach for Pre-Routing Parasitic RC Prediction,2025,Proceedings of the 30th Asia and South Pacific Design Automation Conference,Not Disscused,"Predicting the quality of post-route design at an early stage can reduce overall design time. To achieve this, we propose ParaFormer, a pre-routing parasitic RC prediction framework. This framework integrates a heterogeneous graph neural network (HGNN) and a graph transformer to capture the topological and geometric infor- mation of circuit data. The HGNN model represents circuit data as heterogeneous graphs to learn complex topological relationships, while the graph transformer calculates atten",Proposed model (name not captured),"MPNN/message passing, Graph Transformer",Not Disscused,Not Disscused,Not Disscused,,Real-world,Healthcare,Not Disscused,SOFTMAX,Introduce non-linearity,Not Disscused,Not Disscused,"Node classification, Prediction",Not Disscused,"Mean, Sum, Max, Attention","Mean, Sum, Max, Attention",Not Disscused,Weight decay/L2,Not Disscused,DGL,Not Disscused,Yes,Not Disscused,"Mean, Sum, Max, Attention",Not Disscused,Not Disscused,"MPNN/message passing, Graph Transformer",Not Disscused,Yes,Yes,Yes,Not Disscused,Not Disscused,"Heterogeneous, Temporal/Dynamic, Homogeneous","XGBoost, Transformer",ACM
178,FLAG: Fraud Detection with LLM-enhanced Graph Neural Network,2025,Proceedings of the 31st ACM SIGKDD Conference on Knowledge Discovery and Data Mining V.2,Not Disscused,"Graph-based methods have proven effective in financial fraud de- tection by modeling relationships between entities, yet they often fail to leverage the rich textual information present in real-world data. With the ability to understand semantic information, large lan- guage models (LLMs) offer a promising solution to enhance fraud detection by incorporating textual data, such as user profiles and transaction descriptions. However, integrating LLMs with graph- based methods introduces two key ch",Proposed model (name not captured),"GCN, GAT, GraphSAGE, HAN, MPNN/message passing",Not Disscused,"Amazon, Yelp, Reddit, This, Instagram, Both",Public,,Real-world,Healthcare,Yes,SOFTMAX,Introduce non-linearity,"Cross-Entropy, Binary Cross-Entropy",Adam/AdamW,"Node classification, Recommendation",BERT,"Mean, Sum, Max, Attention","Mean, Sum, Max, Attention","Semi-supervised, Contrastive, Inductive",Early stopping,Not Disscused,Not Disscused,Not Disscused,Not Disscused,Not Disscused,"Mean, Sum, Max, Attention",Not Disscused,Not Disscused,"GCN, GAT, GraphSAGE, HAN",Not Disscused,Yes,Yes,Yes,Yes,"Semi-supervised, Contrastive, Inductive","Heterogeneous, Temporal/Dynamic, Hypergraph","GCN, GAT, GraphSAGE, BERT",ACM
179,LightKG: Efficient Knowledge-Aware Recommendations with Simplified GNN Architecture,2025,Proceedings of the 31st ACM SIGKDD Conference on Knowledge Discovery and Data Mining V.2,Not Disscused,"Recently, Graph Neural Networks (GNNs) have become the domi- nant approach for Knowledge Graph-aware Recommender Systems (KGRSs) due to their proven effectiveness. Building upon GNN- based KGRSs, Self-Supervised Learning (SSL) has been incorporated to address the sparity issue, leading to longer training time. How- ever, through extensive experiments, we reveal that: (1)compared to other KGRSs, the existing GNN-based KGRSs fail to keep their superior performance under sparse interactions even wi",GNN,"GCN, HAN",Not Disscused,"Amazon, MovieLens, ML-1M",Not Disscused,https://grouplens.org/datasets/hetrec-2011/; https://jmcauley.ucsd.edu/data/amazon/; https://grouplens.org/datasets/movielens/1m/,Real-world,Healthcare,Yes,"TANH, SIGMOID",Introduce non-linearity,Not Disscused,Adam/AdamW,"Node classification, Recommendation",Not Disscused,"Mean, Sum, Max, Attention","Mean, Sum, Max, Attention","Semi-supervised, Self-supervised, Contrastive",Not Disscused,Not Disscused,Not Disscused,Not Disscused,Yes,Not Disscused,"Mean, Sum, Max, Attention",Not Disscused,Not Disscused,"GCN, HAN",Not Disscused,Yes,Not Disscused,Yes,Yes,"Semi-supervised, Self-supervised, Contrastive","Heterogeneous, Temporal/Dynamic, Knowledge graph","GCN, LightGCN",https://github.com/1371149/LightKG.
180,Local Homophily-Aware Graph Neural Network with Adaptive Polynomial Filters for Scalable Graph Anomaly Detection,2025,Proceedings of the 31st ACM SIGKDD Conference on Knowledge Discovery and Data Mining V.2,Not Disscused,"This paper presents the Local Homophily Graph Neural Network (LH-GNN), a novel framework for Graph Anomaly Detection (GAD). Anomalous activities in graphs often exhibit a complex interplay of homophily and heterophily, with our analysis revealing that anomalous nodes typically display a higher degree of heterophily compared to normal nodes. Existing GNN-based methods start to incorporate heterophily modeling but fail to address two critical challenges: (1) the efficiency challenge, as traditiona",Proposed model (name not captured),"GCN, GAT, GraphSAGE, GIN, MPNN/message passing",Not Disscused,"Amazon, Yelp, T-Finance, T-Social, YelpChi, Finance, Both",Not Disscused,,Real-world,Healthcare,Yes,"ReLU, SIGMOID",Introduce non-linearity,Cross-Entropy,Adam/AdamW,"Node classification, Prediction",Not Disscused,"Mean, Sum, Max, Attention","Mean, Sum, Max, Attention","Semi-supervised, Contrastive, Inductive",Weight decay/L2,Not Disscused,DGL,Not Disscused,Yes,Not Disscused,"Mean, Sum, Max, Attention",Not Disscused,Not Disscused,"GCN, GAT, GraphSAGE, GIN",10,Yes,Yes,Yes,Yes,"Semi-supervised, Contrastive, Inductive","Heterogeneous, Temporal/Dynamic","GCN, GAT, GraphSAGE, GIN, MLP, Transformer",https://github.com/lotteryai/LHGNN
181,SMA-GNN: A Symbol-Aware Graph Neural Network for Signed Link Prediction in Recommender Systems,2025,Proceedings of the 31st ACM SIGKDD Conference on Knowledge Discovery and Data Mining V.2,Not Disscused,"Recommender Systems (RS) play a critical role in enhancing user experiences across online platforms by modeling user-item inter- actions as bipartite graphs. Predicting signed links in such graphs remains challenging due to the sparsity and complexity of sign dis- tributions and the limitations of traditional methods like matrix fac- torization and Graph Convolutional Networks (GCNs), which often fail to capture the intricate local topological and sign-based patterns essential for accurate predi",Not Disscused,"GCN, GIN, HAN, MPNN/message passing, Graph Transformer",Not Disscused,"Amazon, Each, Amazon-book, ML-10M, Amazon-Book, Book",Public,,Real-world,Healthcare,Yes,"ReLU, SIGMOID, SOFTMAX",Introduce non-linearity,Cross-Entropy,Adam/AdamW,"Node classification, Link prediction/classification","BERT, CNN","Mean, Sum, Max, Attention","Mean, Sum, Max, Attention","Semi-supervised, Self-supervised, Contrastive",Not Disscused,Not Disscused,Not Disscused,Not Disscused,Not Disscused,Not Disscused,"Mean, Sum, Max, Attention",Not Disscused,Not Disscused,"GCN, GIN, HAN, MPNN/message passing",Not Disscused,Yes,Not Disscused,Not Disscused,Not Disscused,"Semi-supervised, Self-supervised, Contrastive","Heterogeneous, Knowledge graph, Hypergraph","GCN, GIN, MLP, Transformer, LightGCN",https://github.com/xiaohuzidefeijian/SMAGNN/tree/master
182,Scalable Inter-County Food Flow Prediction Using Graph Neural Networks,2025,Proceedings of the 33rd ACM International Conference on Advances in Geographic Information Systems,Not Disscused,"Understanding the spatial distribution of food flows is critical for assessing commodity supply chain resilience, infrastructure plan- ning, and environmental impact. However, high-resolution trade data, especially at the county level and across specific commodity groups, are rarely available. In this study, we present a deep learning framework based on a Graph Neural Network (GNN) to predict food flows at the US county level across seven major commodity categories (Standard Classification of Tr",Proposed model (name not captured),"GCN, GAT, HAN",Not Disscused,Not Disscused,Not Disscused,www.census.gov/data/datasets/2017/demo/saipe/2017-state-and-county.html; https://geodata.bts.gov/datasets/usdot::principal-; https://www2.census.gov/programs-surveys/cfs/data/2017/.,Real-world,Healthcare,Yes,Not Disscused,Not Disscused,"Binary Cross-Entropy, MSE",SGD,"Prediction, Classification",CNN,"Mean, Sum, Max, Attention","Mean, Sum, Max, Attention","Federated, Supervised",Not Disscused,Not Disscused,Not Disscused,Not Disscused,Yes,Not Disscused,"Mean, Sum, Max, Attention",Not Disscused,Not Disscused,"GCN, GAT, HAN",Not Disscused,Yes,Yes,Yes,Not Disscused,"Federated, Supervised","Heterogeneous, Temporal/Dynamic, Knowledge graph, Homogeneous","GCN, GAT",https://github.com/GeoDS/
183,UQGNN: Uncertainty Quantification of Graph Neural Networks for Multivariate Spatiotemporal Prediction,2025,Proceedings of the 33rd ACM International Conference on Advances in Geographic Information Systems,Not Disscused,"Spatiotemporal prediction plays a critical role in numerous real- world applications such as urban planning, transportation opti- mization, disaster response, and pandemic control. In recent years, researchers have made significant progress by developing advanced deep learning models for spatiotemporal prediction. However, most existing models are deterministic, i.e., predicting only the expected mean values without quantifying uncertainty, leading to poten- tially unreliable and inaccurate outc",Not Disscused,"GCN, HAN, Hypergraph, Spatio-temporal, STGCN",Not Disscused,"Shenzhen, Chicago, NYC",Not Disscused,https://data.cityofchicago.org/Transportation/Divvy-; https://data.cityofchicago.org/Public-Safety/Crimes-2022/9hwr-; https://data.cityofchicago.org/Transportation/Taxi-Trips-2013-,Real-world,Transportation/Traffic,Yes,ReLU,Introduce non-linearity,"MSE, MAE, NLL",Adam/AdamW,"Recommendation, Prediction","CNN, LSTM","Mean, Sum, Max, Attention","Mean, Sum, Max, Attention","Self-supervised, Supervised","Dropout, Early stopping",Not Disscused,Not Disscused,Not Disscused,Not Disscused,Not Disscused,"Mean, Sum, Max, Attention",Yes,Regularization,"GCN, HAN, Hypergraph, Spatio-temporal",Not Disscused,Yes,Yes,Yes,Yes,"Self-supervised, Supervised","Heterogeneous, Temporal/Dynamic, Hypergraph, Homogeneous","GCN, MLP, CNN, LSTM, Transformer",https://github.com/UFOdestiny/UQGNN.
184,Geometric Heterogeneous Graph Neural Network for Protein-Ligand Binding Affinity Prediction,2025,Proceedings of the 34th ACM International Conference on Information and Knowledge Management,Not Disscused,"Accurately predicting protein-ligand binding affinity (PLA) remains a critical challenge in structure-based drug discovery. Recent ad- vances have focused on using geometry-aware graph neural net- works to model the three-dimensional (3D) structure of protein- ligand complexes for PLA prediction. However, they still achieve suboptimal performance due to two potential issues. 1) Represent- ing the protein-ligand complex as a homogeneous graph ignores the inherent difference between intra- and int",Proposed model (name not captured),"HAN, MPNN/message passing",Not Disscused,LBA,Not Disscused,,Real-world,Healthcare,Yes,Not Disscused,Not Disscused,MSE,Adam/AdamW,"Prediction, Classification",CNN,"Mean, Sum, Max, Attention","Mean, Sum, Max, Attention","Self-supervised, Inductive, Supervised","Weight decay/L2, Early stopping, Normalization",Not Disscused,PyTorch Geometric,"BatchNorm, GraphNorm",Not Disscused,Readout (unspecified),"Mean, Sum, Max, Attention",Not Disscused,Not Disscused,"HAN, MPNN/message passing",Not Disscused,Yes,Yes,Yes,Not Disscused,"Self-supervised, Inductive, Supervised","Heterogeneous, Temporal/Dynamic, Homogeneous",MLP,https://github.com/fhuang233/GeoHGN.
185,Funnel graph neural networks with multi-granularity cascaded fusing for protein–protein interaction prediction,2024,Expert Systems With Applications,China,"The identification of potential protein–protein interactions (PPIs) between humans and viruses is crucial for comprehending viral infection and disease mechanisms at the molecular level. Recently, graph neural networks (GNNs) have emerged as a promising approach to expedite PPI identification.",Not Disscused,"GAT, GCN, Transformer",Not Disscused,"Ablation, After, DB1, DB2, DB3, DB4, Edge, FGNN",Public,https://doi.org/10.1016/j.eswa.2024.125030,Benchmark,Bioinformatics,Not Disscused,"ELU, ReLU, Sigmoid, Softmax, Tanh",Non-linear transformation,Cross-Entropy,Adam,Classification,Embedding layer (mentioned),Attention,Attention,Supervised,"Dropout, Weight decay/L2",Pooling (mentioned),PyTorch,Not Disscused,Smoothing (mentioned),Not Disscused,Not Disscused,Dropout,Regularization,"GAT, GCN, GNN (unspecified), Graph Transformer, Heterogeneous GNN, LightGCN",Not Disscused,Yes,Yes,Yes,Yes,?,bipartite graph,Not Disscused,ACM
186,GNN-Based Performance Prediction of Quantum Optimization of Maximum Independent Set,2025,Proceedings of the 43rd IEEE/ACM International Conference on Computer-Aided Design,Not Disscused,"Maximum Independent Set (MIS) is an NP-hard optimization prob- lem with wide-ranging applications in science and technology. Recently, a super-linear speedup over classical simulated anneal- ing in solving MIS was experimentally observed using a Rydberg atom array (RAA) quantum computer. The extent of the observed speedup depended on the graph instance and the circuit depth of the quantum algorithm. Due to the limited availability of RAA, it is beneficial to be able to efficiently predict the qu",Proposed model (name not captured),"GCN, HAN, MPNN/message passing",Not Disscused,"Amazon, Harvard, Aquila",Not Disscused,,Not Disscused,Healthcare,Not Disscused,"ReLU, ELU",Introduce non-linearity,"MSE, MAE",Adam/AdamW,"Prediction, Classification",CNN,"Mean, Sum, Max, Attention","Mean, Sum, Max, Attention","Semi-supervised, Supervised",Not Disscused,Not Disscused,PyTorch,Not Disscused,Yes,Readout (unspecified),"Mean, Sum, Max, Attention",Not Disscused,Not Disscused,"GCN, HAN, MPNN/message passing",Not Disscused,Yes,Yes,Yes,Yes,"Semi-supervised, Supervised",Temporal/Dynamic,"GCN, MLP, CNN",https://github.com/UCLA-VAST/RAAMIS.
187,Towards Forecasting Bus Arrival Thorough A Model Based On GNN+LSTM Using GTFS and Real-time Data,2025,Proceedings of the 4th International Conference on AI-ML Systems,Not Disscused,"The city’s Public Transportation Network (PTN) organizes daily mobility services for millions of people. Some cities worldwide have used urban computing toolkits to handle acquisition, integration, and data analysis, which translates to improving mobility services, such as mitigating and notifying delays. Regarding the PTN, many urban computing approaches rely on two specifications: General Transit Feed Specification (GTFS), which represents the static sched- ule information, and General Transit",Not Disscused,GCN,Not Disscused,Not Disscused,Not Disscused,https://dados.pbh.gov.br/dataset/tempo_real_onibus_-_coordenada,Real-world,Transportation/Traffic,Not Disscused,Not Disscused,Not Disscused,MAE,Not Disscused,"Prediction, Classification",LSTM,"Mean, Sum, Max","Mean, Sum, Max",Not Disscused,"Dropout, Weight decay/L2",Not Disscused,PyTorch Geometric,Not Disscused,Not Disscused,Not Disscused,"Mean, Sum, Max",Yes (0.1),Regularization,GCN,128,Not Disscused,Yes,Yes,Not Disscused,Not Disscused,Temporal/Dynamic,"GCN, SVM, LSTM",ACM
