Sr. No,Name,Year,Coference Name,Country,Brief Detail,Proposed Model,Used Model,Reason to Use that model,DataSet,Avalibility,Dataset URL,Nature of the Dataset,"Domain, Nature",Filtering,Activation Functions,Purpose of Activation,Loss Function,Optimizer,Classification,Start Embedding (Feature Extraction),Embedding Aggregator,Aggregate Function,Embedding (Learning),Regularization Technique,Pooling,Tootkit,Normalization,Smoothing,READOUT,READOUT Operation,Dropout Layer,Purpose of Dropout,GNN Variant,Embedding Size,Attention,Spatial,Temporal,Spectral,Setting,Graph Type,Compared With,Repository
106,Adversarial Circuit Rewriting against Graph Neural Network-based Operator Detection,2024,ACM Trans. Des. Autom. Electron. Syst.,Not Disscused,Not Disscused,Not Disscused,"GCN, GAT, GraphSAGE",Not Disscused,Not Disscused,Not Disscused,,Benchmark,Healthcare,Not Disscused,SOFTMAX,Introduce non-linearity,Not Disscused,Adam/AdamW,"Prediction, Classification",Not Disscused,"Mean, Sum, Max, Attention","Mean, Sum, Max, Attention",Not Disscused,Not Disscused,Not Disscused,Not Disscused,Not Disscused,Not Disscused,Not Disscused,"Mean, Sum, Max, Attention",Not Disscused,Not Disscused,"GCN, GAT, GraphSAGE",Not Disscused,Yes,Not Disscused,Not Disscused,Not Disscused,Not Disscused,Not Disscused,"GCN, GAT",ACM
107,Collaborative Sequential Recommendations via Multi-view GNN-transformers,2024,ACM Trans. Inf. Syst.,Not Disscused,Not Disscused,Not Disscused,"GCN, GAT, GraphSAGE, MPNN/message passing, Hypergraph",Not Disscused,"Amazon, Yelp, MovieLens, ML-1M, CDs, Tmall",Public,https://grouplens.org/datasets/movielens/1m/; https://www.yelp.com/dataset; https://jmcauley.ucsd.edu/data/amazon/,Benchmark,Healthcare,Yes,SIGMOID,Introduce non-linearity,"Cross-Entropy, Contrastive loss",Adam/AdamW,"Recommendation, Prediction","BERT, CNN, LSTM, GRU","Mean, Sum, Max, Attention","Mean, Sum, Max, Attention","Self-supervised, Contrastive, Inductive",Not Disscused,Not Disscused,PyTorch,Not Disscused,Not Disscused,Not Disscused,"Mean, Sum, Max, Attention",Not Disscused,Not Disscused,"GCN, GAT, GraphSAGE, MPNN/message passing",128,Yes,Not Disscused,Yes,Not Disscused,"Self-supervised, Contrastive, Inductive","Temporal/Dynamic, Knowledge graph, Hypergraph","GCN, GAT, CNN, LSTM, GRU, BERT, Transformer",ACM
108,A Spatial-Temporal Aggregated Graph Neural Network for Docked Bike-sharing Demand Forecasting,2024,ACM Trans. Knowl. Discov. Data,Not Disscused,Not Disscused,Not Disscused,"GCN, GAT, HAN, Spatio-temporal",Not Disscused,"Divvy, Citi, Capital, Lyft, Each",Not Disscused,https://ride.divvybikes.com/system-data; https://ride.citibikenyc.com/system-data; https://ride.capitalbikeshare.com/system-data,Real-world,Transportation/Traffic,Yes,"LEAKYRELU, SOFTMAX",Introduce non-linearity,"MSE, MAE",Adam/AdamW,"Prediction, Classification","CNN, LSTM, GRU","Mean, Sum, Max, Attention","Mean, Sum, Max, Attention",Not Disscused,Not Disscused,Not Disscused,Not Disscused,Not Disscused,Not Disscused,Not Disscused,"Mean, Sum, Max, Attention",Not Disscused,Not Disscused,"GCN, GAT, HAN, Spatio-temporal",Not Disscused,Yes,Yes,Yes,Not Disscused,Not Disscused,Temporal/Dynamic,"GCN, GAT, MLP, CNN, LSTM, GRU",ACM
109,Asymmetric Learning for Graph Neural Network based Link Prediction,2024,ACM Trans. Knowl. Discov. Data,Not Disscused,Not Disscused,Not Disscused,"GCN, GAT, MPNN/message passing",Not Disscused,Not Disscused,Not Disscused,,Benchmark,Healthcare,Not Disscused,Not Disscused,Not Disscused,Cross-Entropy,Adam/AdamW,"Link prediction/classification, Recommendation",Not Disscused,"Mean, Sum, Max, Attention","Mean, Sum, Max, Attention","Semi-supervised, Inductive, Supervised",Normalization,Not Disscused,PyTorch Geometric,"BatchNorm, GraphNorm",Not Disscused,Readout (unspecified),"Mean, Sum, Max, Attention",Not Disscused,Not Disscused,"GCN, GAT, MPNN/message passing",Not Disscused,Yes,Not Disscused,Not Disscused,Yes,"Semi-supervised, Inductive, Supervised",Knowledge graph,"GCN, GAT, MLP",ACM
110,MagNet: Multilevel Dynamic Wavelet Graph Neural Network for Multivariate Time Series Classification,2024,ACM Trans. Knowl. Discov. Data,Not Disscused,Not Disscused,Not Disscused,"GIN, HAN, MPNN/message passing, Spatio-temporal",Not Disscused,"UEA, MTS, MTSC",Not Disscused,,Real-world,Transportation/Traffic,Yes,"ReLU, TANH",Introduce non-linearity,Cross-Entropy,Not Disscused,"Graph classification, Recommendation","CNN, LSTM","Mean, Sum, Max, Attention","Mean, Sum, Max, Attention","Semi-supervised, Self-supervised, Contrastive",Normalization,Not Disscused,PyTorch Geometric,BatchNorm,Not Disscused,Readout (unspecified),"Mean, Sum, Max, Attention",Not Disscused,Not Disscused,"GIN, HAN, MPNN/message passing, Spatio-temporal",Not Disscused,Yes,Yes,Yes,Yes,"Semi-supervised, Self-supervised, Contrastive",Temporal/Dynamic,"GIN, MLP, CNN, LSTM, Transformer",ACM
111,Package Arrival Time Prediction via Knowledge Distillation Graph Neural Network,2024,ACM Trans. Knowl. Discov. Data,Not Disscused,Not Disscused,Not Disscused,"GCN, GraphSAGE, HAN, Graph Transformer, Hypergraph",Not Disscused,"Alibaba, For",Not Disscused,,Real-world,Healthcare,Not Disscused,"ReLU, SOFTMAX",Introduce non-linearity,MAE,Not Disscused,"Prediction, Classification","CNN, LSTM, GRU","Mean, Sum, Max, Attention","Mean, Sum, Max, Attention","Inductive, Supervised, Unsupervised","Dropout, Weight decay/L2",Not Disscused,PyTorch Geometric,Not Disscused,Not Disscused,Not Disscused,"Mean, Sum, Max, Attention",Yes,Regularization,"GCN, GraphSAGE, HAN, Graph Transformer",Not Disscused,Yes,Yes,Yes,Not Disscused,"Inductive, Supervised, Unsupervised","Heterogeneous, Temporal/Dynamic, Hypergraph","GCN, GraphSAGE, MLP, CNN, LSTM, GRU, XGBoost, Transformer",ACM
112,Prerequisite-Enhanced Category-Aware Graph Neural Networks for Course Recommendation,2024,ACM Trans. Knowl. Discov. Data,Not Disscused,Not Disscused,Not Disscused,GCN,Not Disscused,"MOOC, Udemy",Not Disscused,,Real-world,Healthcare,Yes,"TANH, SIGMOID, SOFTMAX",Introduce non-linearity,Cross-Entropy,Not Disscused,"Recommendation, Prediction","LSTM, GRU","Mean, Sum, Max, Attention","Mean, Sum, Max, Attention",Not Disscused,Weight decay/L2,Not Disscused,PyTorch,Not Disscused,Not Disscused,Not Disscused,"Mean, Sum, Max, Attention",Not Disscused,Not Disscused,GCN,Not Disscused,Yes,Not Disscused,Yes,Not Disscused,Not Disscused,"Heterogeneous, Temporal/Dynamic, Knowledge graph","GCN, LSTM, GRU, LightGCN",ACM
113,Towards Differential Privacy in Sequential Recommendation: A Noisy Graph Neural Network Approach,2024,ACM Trans. Knowl. Discov. Data,Not Disscused,Not Disscused,Not Disscused,GNN,Not Disscused,"Amazon, Yelp, Tmall",Not Disscused,https://www.yelp.com/dataset,Real-world,Healthcare,Yes,Not Disscused,Not Disscused,Cross-Entropy,Adam/AdamW,"Node classification, Recommendation","BERT, CNN, GRU","Mean, Sum, Max, Attention","Mean, Sum, Max, Attention","Semi-supervised, Federated, Inductive",Not Disscused,Not Disscused,Not Disscused,Not Disscused,Not Disscused,Readout (unspecified),"Mean, Sum, Max, Attention",Not Disscused,Not Disscused,GNN,Not Disscused,Yes,Not Disscused,Yes,Not Disscused,"Semi-supervised, Federated, Inductive","Heterogeneous, Temporal/Dynamic","GRU, BERT, Transformer, LightGCN",ACM
114,HDM-GNN: A Heterogeneous Dynamic Multi-view Graph Neural Network for Crime Prediction,2024,ACM Trans. Sen. Netw.,Not Disscused,Not Disscused,Not Disscused,"GCN, GAT, Graph Transformer, Spatio-temporal, STGCN",Not Disscused,"All, POI, NYC2020",Not Disscused,https://github.com/ZJUDataIntelligence/HDM-GNN.; https://opendata.cityofnewyork.us/; https://crime-data-explorer.app.cloud.gov/pages/explorer/,Real-world,Healthcare,Not Disscused,SIGMOID,Introduce non-linearity,MAE,Adam/AdamW,"Prediction, Classification","CNN, LSTM","Mean, Sum, Attention","Mean, Sum, Attention","Semi-supervised, Federated, Inductive",Not Disscused,Not Disscused,Not Disscused,Not Disscused,Not Disscused,Not Disscused,"Mean, Sum, Attention",Not Disscused,Not Disscused,"GCN, GAT, Graph Transformer, Spatio-temporal",Not Disscused,Yes,Yes,Yes,Yes,"Semi-supervised, Federated, Inductive","Heterogeneous, Temporal/Dynamic","GCN, GAT, CNN, LSTM",https://github.com/ZJUDataIntelligence/HDM-GNN.
115,Heterogeneous Graph Neural Network with Personalized and Adaptive Diversity for News Recommendation,2024,ACM Trans. Web,Not Disscused,Not Disscused,Not Disscused,"HAN, MPNN/message passing, Hypergraph",Not Disscused,"Amazon, MIND, Adressa",Not Disscused,https://query.wikidata.org/,Real-world,Transportation/Traffic,Yes,"SIGMOID, SOFTMAX",Introduce non-linearity,Cross-Entropy,"Adam/AdamW, SGD","Node classification, Link prediction/classification","BERT, LSTM","Mean, Sum, Max, Attention","Mean, Sum, Max, Attention","Self-supervised, Contrastive, Inductive",Dropout,Not Disscused,DGL,Not Disscused,Yes,Not Disscused,"Mean, Sum, Max, Attention",Yes,Regularization,"HAN, MPNN/message passing, Hypergraph",Not Disscused,Yes,Not Disscused,Yes,Not Disscused,"Self-supervised, Contrastive, Inductive","Heterogeneous, Temporal/Dynamic, Knowledge graph, Hypergraph, Homogeneous","MLP, LSTM, BERT, Transformer",https://github.com/aSeriousCoder/DivHGNN.
116,An End-to-End Knowledge Graph Fused Graph Neural Network for Accurate Protein-Protein Interactions Prediction,2024,IEEE/ACM Trans. Comput. Biol. Bioinformatics,Not Disscused,"—Protein-protein interactions (PPIs) are essential to understanding cellular mechanisms, signaling networks, disease processes, and drug development, as they represent the physical contacts and functional associations between proteins. Recent ad- vances have witnessed the achievements of artiﬁcial intelligence (AI) methods aimed at predicting PPIs. However, these approaches often handle the intricate web of relationships and mechanisms among proteins, drugs, diseases, ribonucleic acid (RNA), and",Not Disscused,"GCN, HAN, Graph Transformer",Not Disscused,"PPI, PAN",Not Disscused,,Real-world,Healthcare,Not Disscused,SIGMOID,Introduce non-linearity,Cross-Entropy,Not Disscused,"Link prediction/classification, Prediction",CNN,"Mean, Sum, Attention","Mean, Sum, Attention","Semi-supervised, Supervised","Dropout, Normalization",Not Disscused,PyTorch,BatchNorm,Not Disscused,Not Disscused,"Mean, Sum, Attention",Yes,Regularization,"GCN, HAN, Graph Transformer",Not Disscused,Yes,Yes,Yes,Not Disscused,"Semi-supervised, Supervised","Heterogeneous, Temporal/Dynamic, Knowledge graph",GCN,https://github.com/liyapeng-coder/KGF-GNN.
117,PPRTGI: A Personalized PageRank Graph Neural Network for TF-Target Gene Interaction Detection,2024,IEEE/ACM Trans. Comput. Biol. Bioinformatics,Not Disscused,"—Transcription factors (TFs) regulation is required for the vast majority of biological processes in living organisms. Some diseases may be caused by improper transcriptional regulation. Identifying the target genes of TFs is thus critical for understanding cellular processes and analyzing disease molecular mechanisms. Computational approaches can be challenging to employ when attempting to predict potential interactions between TFs and target genes. In this paper, we present a novel graph model",PPRTGI,"GCN, GAT, GraphSAGE, HAN, MPNN/message passing",Not Disscused,Expanded,Public,,Benchmark,Healthcare,Not Disscused,"SIGMOID, SOFTMAX",Introduce non-linearity,Cross-Entropy,Not Disscused,"Link prediction/classification, Prediction","word2vec, CNN","Mean, Sum, Max, Attention","Mean, Sum, Max, Attention","Semi-supervised, Inductive, Supervised",Dropout,Not Disscused,Not Disscused,Not Disscused,Not Disscused,Not Disscused,"Mean, Sum, Max, Attention",Yes,Regularization,"GCN, GAT, GraphSAGE, HAN",Not Disscused,Yes,Yes,Yes,Not Disscused,"Semi-supervised, Inductive, Supervised","Heterogeneous, Temporal/Dynamic","GCN, GAT, GraphSAGE, CNN, XGBoost",https://github.com/MKCharlotte/PPRTGI.
118,circ2DGNN: circRNA-Disease Association Prediction via Transformer-Based Graph Neural Network,2024,IEEE/ACM Trans. Comput. Biol. Bioinformatics,Not Disscused,"—Investigating the associations between circRNA and diseases is vital for comprehending the underlying mechanisms of diseases and formulating effective therapies. Computational prediction methods often rely solely on known circRNA-disease data, indirectly incorporating other biomolecules’ effects by com- puting circRNA and disease similarities based on these molecules. However, this approach is limited, as other biomolecules also play signiﬁcant roles in circRNA-disease interactions. To address ",Not Disscused,"GCN, MPNN/message passing",Not Disscused,Not Disscused,Public,,Real-world,Healthcare,Not Disscused,SOFTMAX,Introduce non-linearity,Not Disscused,Not Disscused,"Link prediction/classification, Prediction","word2vec, CNN","Mean, Sum, Max, Attention","Mean, Sum, Max, Attention","Semi-supervised, Supervised","Dropout, Weight decay/L2",Not Disscused,DGL,Not Disscused,Not Disscused,Not Disscused,"Mean, Sum, Max, Attention",Yes,Regularization,"GCN, MPNN/message passing",Not Disscused,Yes,Not Disscused,Not Disscused,Not Disscused,"Semi-supervised, Supervised",Heterogeneous,"GCN, Transformer",ACM
119,Pitfalls in Link Prediction with Graph Neural Networks: Understanding the Impact of Target-link Inclusion &amp; Better Practices,2024,Proceedings of the 17th ACM International Conference on Web Search and Data Mining,Not Disscused,"While Graph Neural Networks (GNNs) are remarkably successful in a variety of high-impact applications, we demonstrate that, in link prediction, the common practices of including the edges being predicted in the graph at training and/or test have outsized impact on the performance of low-degree nodes. We theoretically and em- pirically investigate how these practices impact node-level perfor- mance across different degrees. Specifically, we explore three issues that arise: (I1) overfitting; (I2) ",Proposed model (name not captured),"GCN, HAN, MPNN/message passing",Not Disscused,"Amazon, E-commerce, E-Commerce",Public,,Real-world,Healthcare,Yes,ReLU,Introduce non-linearity,Not Disscused,Adam/AdamW,"Node classification, Link prediction/classification",Not Disscused,"Mean, Sum, Max, Attention","Mean, Sum, Max, Attention","Semi-supervised, Inductive, Supervised",Not Disscused,Not Disscused,"PyTorch Geometric, DGL",Not Disscused,Not Disscused,Not Disscused,"Mean, Sum, Max, Attention",Not Disscused,Not Disscused,"GCN, HAN, MPNN/message passing",Not Disscused,Yes,Not Disscused,Not Disscused,Not Disscused,"Semi-supervised, Inductive, Supervised",Knowledge graph,GCN,ACM
120,GNN-IDS: Graph Neural Network based Intrusion Detection System,2024,"Proceedings of the 19th International Conference on Availability, Reliability and Security",Not Disscused,"Intrusion detection systems (IDSs) are widely used to identify anom- alies in computer networks and raise alarms on intrusive behav- iors. ML-based IDSs generally take network traces or host logs as input to extract patterns from individual samples, whereas the inter-dependencies of network are often not captured and learned, which may result in large amounts of uncertain predictions, false positives, and false negatives. To tackle the challenges in intru- sion detection, we propose a graph neur",Proposed model (name not captured),"GCN, GAT, GraphSAGE, MPNN/message passing",Not Disscused,"CIC-IDS2017, CTU-13, DDoS, TOR-nonTOR, BETH",Public,,Real-world,Transportation/Traffic,Yes,"ReLU, LEAKYRELU, SIGMOID",Introduce non-linearity,Cross-Entropy,Adam/AdamW,"Prediction, Classification",CNN,"Mean, Sum, Max, Attention","Mean, Sum, Max, Attention","Semi-supervised, Supervised, Unsupervised",Not Disscused,Not Disscused,PyTorch,Not Disscused,Not Disscused,Readout (unspecified),"Mean, Sum, Max, Attention",Not Disscused,Not Disscused,"GCN, GAT, GraphSAGE, MPNN/message passing",Not Disscused,Yes,Yes,Yes,Not Disscused,"Semi-supervised, Supervised, Unsupervised",Temporal/Dynamic,"GCN, GAT, GraphSAGE, MLP, SVM, CNN, Random Forest, Transformer",https://github.com/zhenlus/GNN-IDS.git.
121,AAGNN: Adaptive Airport Graph Neural Network for flight sequence prediction,2024,Expert Systems With Applications,China,"Adaptive learning Graph neural network Flight sequence prediction Session-based recommendation A B S T R A C T Flight sequence is essential for aviation’s secure and orderly operation. Accurate Flight Sequence Prediction (FSP) gives air traffic controllers (ATCs) an overview of the overall air traffic situation during the pre-tactical phase, allowing them to modify flight schedules when airspace c",AAGNN,"GCN, Transformer",Not Disscused,"AAGNN, China, Chinese, For, More, Plot",Public,https://doi.org/10.1016/j.eswa.2024.125013,Benchmark,Transportation,Not Disscused,Softmax,Non-linear transformation,Cross-Entropy,Adam,Recommendation,One-hot features,Attention,Attention,Self-supervised/Contrastive,Weight decay/L2,mean pooling,Not Disscused,Not Disscused,Not Disscused,Not Disscused,Not Disscused,Not Disscused,Not Disscused,"GCN, GNN (unspecified), Graph Transformer, Heterogeneous GNN",Not Disscused,Yes,Yes,Yes,Not Disscused,?,?,Not Disscused,ACM
122,Realtime Disaster Detection Through GNN Models Using Disaster Knowledge Graphs,2024,Proceedings of the 2023 IEEE/ACM International Conference on Advances in Social Networks Analysis and Mining,Not Disscused,"—In the context of the increasing scale and complexity of disasters caused by rapid climate change, a comprehensive understanding of disaster big data is essential for effective detec- tion and response. The disaster knowledge graph proposed in this paper fills this gap by capturing the connections between various disaster-related data sources and their potential for growth across heterogeneous datasets. We generate time-series disaster graphs every minute using SNS data (e.g., Twitter) and publ",Not Disscused,"GCN, GAT, GraphSAGE",Not Disscused,Not Disscused,Not Disscused,,Not Disscused,Healthcare,Not Disscused,SOFTMAX,Introduce non-linearity,Not Disscused,Not Disscused,"Graph classification, Link prediction/classification",Not Disscused,"Mean, Sum, Max, Attention","Mean, Sum, Max, Attention","Semi-supervised, Inductive, Supervised",Not Disscused,Not Disscused,Not Disscused,Not Disscused,Not Disscused,Not Disscused,"Mean, Sum, Max, Attention",Not Disscused,Not Disscused,"GCN, GAT, GraphSAGE",Not Disscused,Yes,Not Disscused,Yes,Not Disscused,"Semi-supervised, Inductive, Supervised","Heterogeneous, Temporal/Dynamic, Knowledge graph","GCN, GAT, GraphSAGE",ACM
123,LSTM-GNN: A Multi-Channel Model for Molecular Properties Prediction,2024,Proceedings of the 2024 16th International Conference on Bioinformatics and Biomedical Technology,Not Disscused,"Predicting molecular properties is crucial in drug design and de- velopment. In recent years, machine learning and deep learning models have been widely used for this purpose. However, the in- sights gained from these methods are often not exhaustive, leading to results that fall short of expectations. In this paper, we propose a multi-channel molecular property prediction model, LSTM-GNN, which orchestrates a symphony of a bidirectional long short-term memory network and a graph attention netwo",Proposed model (name not captured),"GCN, GAT, HAN, MPNN, MPNN/message passing",Not Disscused,"MUV, MoleculeNet, This, HIV",Public,,Benchmark,Healthcare,Not Disscused,"ReLU, SOFTMAX",Introduce non-linearity,"Cross-Entropy, Binary Cross-Entropy",Adam/AdamW,"Prediction, Classification","BERT, CNN, LSTM","Sum, Max, Attention","Sum, Max, Attention","Semi-supervised, Self-supervised, Supervised",Dropout,Not Disscused,PyTorch,Not Disscused,Not Disscused,Not Disscused,"Sum, Max, Attention",Yes (0.2),Regularization,"GCN, GAT, HAN, MPNN",Not Disscused,Yes,Not Disscused,Not Disscused,Not Disscused,"Semi-supervised, Self-supervised, Supervised",Heterogeneous,"GCN, GAT, CNN, LSTM, Random Forest, BERT, Transformer",https://github.com/ShiLab-GitHub/LSTM-GNN.
124,A Novel Adaptive Model based on Graph Neural Network for Cross-domain APT Detection in Industrial Systems,2024,Proceedings of the 2024 16th International Conference on Computer Modeling and Simulation,Not Disscused,"The rapid development of Industry 4.0 facilitates the convergence of Information Technology (IT) and Operational Technology (OT), re- sulting in industrial systems becoming susceptible to diverse attack vectors. Advanced Persistent Threats (APTs) employ sophisticated attacks that can infiltrate air-gapped networks, posing significant risks to industrial systems. However, most research usually focuses on hybridizing algorithms and parameter tuning to improve models’ performance, but few studies p",Not Disscused,"GAT, GraphSAGE, HAN",Not Disscused,"CTU-13, APT",Public,,Not Disscused,Transportation/Traffic,Not Disscused,Not Disscused,Not Disscused,Not Disscused,Not Disscused,"Prediction, Classification",Not Disscused,"Mean, Sum, Attention","Mean, Sum, Attention",Inductive,Not Disscused,Not Disscused,PyTorch,Not Disscused,Not Disscused,Not Disscused,"Mean, Sum, Attention",Not Disscused,Not Disscused,"GAT, GraphSAGE, HAN",Not Disscused,Yes,Not Disscused,Yes,Not Disscused,Inductive,"Heterogeneous, Temporal/Dynamic","GAT, GraphSAGE",ACM
125,Slice-level vulnerability detection model based on graph neural network,2024,"Proceedings of the 2024 3rd International Conference on Cryptography, Network Security and Communication Technology",Not Disscused,"It is a challenge for graph neural network (GNN) to deal with con- nections between long-distance nodes in code structure graphs because GNN is naturally bad at handling long-distance dependen- cies and capturing global information of code graphs. GNN are effective in learning graph representations of source code. To ad- dress this issue, this study proposes an attention-based vulnerability detection model. This model aims to maintain the final structure by minimizing redundant information in th",Not Disscused,MPNN/message passing,Not Disscused,"Vul, Big-Vul, BigVul",Not Disscused,,Not Disscused,Healthcare,Not Disscused,"ReLU, SOFTMAX",Introduce non-linearity,Cross-Entropy,Adam/AdamW,"Prediction, Classification",word2vec,"Sum, Max, Attention","Sum, Max, Attention",Not Disscused,"Dropout, Normalization",Not Disscused,Not Disscused,"BatchNorm, LayerNorm",Yes,Not Disscused,"Sum, Max, Attention",Yes,Regularization,MPNN/message passing,Not Disscused,Yes,Not Disscused,Yes,Not Disscused,Not Disscused,Temporal/Dynamic,MLP,ACM
126,Code vulnerability detection method based on taint analysis and graph neural network,2024,Proceedings of the 2024 4th  International Conference on Internet of Things and Machine Learning,Not Disscused,"With the increasing number of software security problems, the increasing types and numbers of vulnerabilities put forward higher requirements for code vulnerability detection methods. Traditional vulnerability detection methods mainly rely on predefined rules and patterns for detection. The vulnerability detection method based on deep learning can avoid the limitations of manually defined rules and patterns and improve the accuracy of detection. However, the existing methods still have the probl",Not Disscused,GNN,Not Disscused,Not Disscused,Not Disscused,,Not Disscused,Healthcare,Yes,"TANH, SIGMOID",Introduce non-linearity,Not Disscused,Not Disscused,Classification,"BERT, word2vec, GRU","Mean, Sum, Attention","Mean, Sum, Attention",Not Disscused,Not Disscused,Not Disscused,Not Disscused,Not Disscused,Not Disscused,Not Disscused,"Mean, Sum, Attention",Not Disscused,Not Disscused,GNN,Not Disscused,Yes,Not Disscused,Yes,Not Disscused,Not Disscused,Temporal/Dynamic,"GRU, BERT",ACM
127,Research on traffic flow prediction based on adaptive spatio-temporal perceptual graph neural network for traffic prediction,2024,"Proceedings of the 2024 4th International Conference on Artificial Intelligence, Big Data and Algorithms",Not Disscused,"Accurate traffic prediction is essential for path planning, people flow monitoring, and urban traffic control in the age of artificial intelligence and big data. Even though academics both domestically and internationally have conducted extensive research on traffic flow prediction in recent years, there are still two main obstacles that need to be overcome: first, the methods currently in use do not fully account for the data correlation between neighboring time nodes; second, because the major",Not Disscused,"HAN, Spatio-temporal, STGCN",Not Disscused,PEMS08,Not Disscused,,Benchmark,Transportation/Traffic,Yes,Not Disscused,Not Disscused,MAE,Not Disscused,"Recommendation, Prediction","CNN, LSTM","Mean, Max, Attention","Mean, Max, Attention",Not Disscused,Not Disscused,Not Disscused,Not Disscused,Not Disscused,Not Disscused,Not Disscused,"Mean, Max, Attention",Not Disscused,Not Disscused,"HAN, Spatio-temporal, STGCN",Not Disscused,Yes,Yes,Yes,Not Disscused,Not Disscused,Temporal/Dynamic,"CNN, LSTM",ACM
